S,MES,D,,,,,AYT,LT,11400,VDHW,N36551490,E030474010,,N36551490,E030474010,E0060,00194,2,,365,WGE,ANTALYA,SMESD        AYT   LT111400VDHW N36551490E030474010    N36551490E030474010E0060001942  365WGEANTALYA                       ,S,Simulation application continuation,SMESD        AYT   LT2S    UN                                             E005500194                                       
S,MES,D,,,,,BAG,LT,11310,VDH,N40041200,E032483560,,N40041200,E032483560,E0060,04800,2,,513,WGE,BAGLUM (ANKARA),SMESD        BAG   LT111310VDH  N40041200E032483560    N40041200E032483560E0060048002  513WGEBAGLUM (ANKARA)               ,S,Simulation application continuation,SMESD        BAG   LT2S    UN                                             E006104800                                       
S,MES,D,,,,,BAM,OI,11490,VDLW,N29043890,E058273000,,N29043890,E058273000,E0020,03145,1,,467,WGE,BAM,SMESD        BAM   OI111490VDLW N29043890E058273000    N29043890E058273000E0020031451  467WGEBAM                           ,S,Simulation application continuation,SMESD        BAM   OI2S    UN                                             E0028                                            
S,MES,D,,,,,BAR,OL,11390,V UW,N33461000,E035332000,,,,E0030,,1,,,U,BAYSUR,SMESD        BAR   OL111390V UW N33461000E035332000                       E0030     1     U  BAYSUR                        ,S,Simulation application continuation,SMESD        BAR   OL2S    UN                                             E0052                                            
S,MES,D,,,,,BAT,LT,11620,VDL,N37561670,E041071060,,N37561670,E041071060,E0060,01847,1,,341,WGE,BATMAN,SMESD        BAT   LT111620VDL  N37561670E041071060    N37561670E041071060E0060018471  341WGEBATMAN                        ,S,Simulation application continuation,SMESD        BAT   LT2S    UN                                             E0059                                            
S,MES,D,,,,,BAT,OE,11340,VDHW,N24125700,E051270710,,N24125700,E051270710,E0020,00300,2,,309,WGE,BATHA,SMESD        BAT   OE111340VDHW N24125700E051270710    N24125700E051270710E0020003002  309WGEBATHA                         ,S,Simulation application continuation,SMESD        BAT   OE2S    UN                                             E0025                                            
S,MES,D,,,,,BBB,VA,11660,VDHW,N19051020,E072522890,,N19051020,E072522890,W0010,00043,2,,595,WGE,MUMBAI,SMESD        BBB   VA111660VDHW N19051020E072522890    N19051020E072522890W0010000432  595WGEMUMBAI                        ,S,Simulation application continuation,SMESD        BBB   VA2S    UN                                             W000000043                                       
S,MES,D,,,,,BBG,VO,11550,VDHW,N12565910,E077405160,,N12565910,E077405160,W0020,02945,2,,,WGE,BENGALURU,SMESD        BBG   VO111550VDHW N12565910E077405160    N12565910E077405160W0020029452     WGEBENGALURU                     ,S,Simulation application continuation,SMESD        BBG   VO2S    UY                                             W001102945                                       
S,MES,D,,,,,BBI,VO,11280,VDHW,N15095533,E076524840,,N15095533,E076524840,W0010,01544,2,,,WGE,BELLARY,SMESD        BBI   VO111280VDHW N15095533E076524840    N15095533E076524840W0010015442     WGEBELLARY                       ,S,Simulation application continuation,SMESD        BBI   VO2S    UN                                             W000801544                                       
S,MES,D,,,,,BBM,VO,11210,VDHW,N15512570,E074370940,,N15512570,E074370940,W0010,02521,2,,,WGE,BELAGAVI,SMESD        BBM   VO111210VDHW N15512570E074370940    N15512570E074370940W0010025212     WGEBELAGAVI                      ,S,Simulation application continuation,SMESD        BBM   VO2S    UN                                             W000602521                                       
S,MES,D,,,,,BBN,VE,11390,VDHW,N25271520,E082513420,,N25271520,E082513420,W0000,00294,2,,,WGE,VARANASI,SMESD        BBN   VE111390VDHW N25271520E082513420    N25271520E082513420W0000002942     WGEVARANASI                      ,S,Simulation application continuation,SMESD        BBN   VE2S    UN                                             E000300294                                       
S,MES,D,,,,,BBS,VE,11350,VDHW,N20143920,E085484680,,N20143920,E085484680,W0010,00158,2,,578,WGE,BHUBANESWAR,SMESD        BBS   VE111350VDHW N20143920E085484680    N20143920E085484680W0010001582  578WGEBHUBANESWAR                   ,S,Simulation application continuation,SMESD        BBS   VE2S    UN                                             W000400158                                       
S,MES,D,,,,,BBZ,VO,11620,VDHW,N16321580,E080500820,,N16321580,E080500820,W0010,00073,2,,,WGE,VIJAYAWADA,SMESD        BBZ   VO111620VDHW N16321580E080500820    N16321580E080500820W0010000732     WGEVIJAYAWADA                    ,S,Simulation application continuation,SMESD        BBZ   VO2S    UU                                             W000700073                                       
S,MES,D,,,,,BDB,OE,11510,VDUW,N24195100,E041492800,,N24195100,E041492800,E0040,03281,1,,497,WGE,BIR DARB,SMESD        BDB   OE111510VDUW N24195100E041492800    N24195100E041492800E0040032811  497WGEBIR DARB                      ,S,Simulation application continuation,SMESD        BDB   OE2S    UN                                             E003603281                                       
S,MES,D,,,,,BDP,VN,11560,VDLW,N26340680,E088053290,,N26340680,E088053290,W0000,00344,1,,473,WGE,CHANDRAGADHI,SMESD        BDP   VN111560VDLW N26340680E088053290    N26340680E088053290W0000003441  473WGECHANDRAGADHI                  ,S,Simulation application continuation,SMESD        BDP   VN2S    UY                                             E000000344                                       
S,MES,D,,,,,BDR,LT,11670,VDH,N37152770,E027381590,,N37152770,E027381590,E0050,00030,2,,471,WGE,MILAS BODRUM,SMESD        BDR   LT111670VDH  N37152770E027381590    N37152770E027381590E0050000302  471WGEMILAS BODRUM                  ,S,Simulation application continuation,SMESD        BDR   LT2S    UU                                             E005400030                                       
S,MES,D,,,,,BDR,VO,11320,VDLW,N17541800,E077285600,,N17541800,E077285600,W0010,02180,1,,542,WGE,BIDAR,SMESD        BDR   VO111320VDLW N17541800E077285600    N17541800E077285600W0010021801  542WGEBIDAR                         ,S,Simulation application continuation,SMESD        BDR   VO2S    UY                                             W000402180                                       
S,MES,D,,,,,BGD,OR,11290,VDHW,N33173160,E044133160,,N33173160,E044133160,E0040,00100,2,,432,WGE,BAGHDAD,SMESD        BGD   OR111290VDHW N33173160E044133160    N33173160E044133160E0040001002  432WGEBAGHDAD                       ,S,Simulation application continuation,SMESD        BGD   OR2S    UN                                             E004800100                                       
S,MES,D,,,,,BGD,VE,11520,VDHW,N26411800,E088193400,,N26411800,E088193400,W0000,00414,2,,,WGE,BAGDOGRA,SMESD        BGD   VE111520VDHW N26411800E088193400    N26411800E088193400W0000004142     WGEBAGDOGRA                      ,S,Simulation application continuation,SMESD        BGD   VE2S    UY                                             E000000414                                       
S,MES,D,,,,,BGM,OA,11270,VTLW,N34570137,E069161742,,N34570137,E069161742,E0030,04852,1,,329,WGE,BAGRAM,SMESD        BGM   OA111270VTLW N34570137E069161742    N34570137E069161742E0030048521  329WGEBAGRAM                        ,S,Simulation application continuation,SMESD        BGM   OA2S    UY                                             E003504852                                       
S,MES,D,,,,,BGN,LL,11350,VDHB,N32004720,E034523130,,N32004720,E034523130,E0050,00100,2,,449,WGE,BEN GURION (TEL AVIV),SMESD        BGN   LL111350VDHB N32004720E034523130    N32004720E034523130E0050001002  449WGEBEN GURION (TEL AVIV)         ,S,Simulation application continuation,SMESD        BGN   LL2S    UN                                             E0050                                            
S,MES,D,,,,,BHA,OE,11350,VTHW,N20173290,E041374490,,N20173290,E041374490,E0030,05500,2,,428,WGE,AL BAHA,SMESD        BHA   OE111350VTHW N20173290E041374490    N20173290E041374490E0030055002  428WGEAL BAHA                       ,S,Simulation application continuation,SMESD        BHA   OE2S    UN                                             E003205500                                       
S,MES,D,,,,,BHR,OB,11180,VDH,N26153000,E050391918,,N26153000,E050391918,E0030,00037,2,,,WGE,BAHRAIN,SMESD        BHR   OB111180VDH  N26153000E050391918    N26153000E050391918E0030000372     WGEBAHRAIN                       ,S,Simulation application continuation,SMESD        BHR   OB2S    UN                                             E002900037                                       
S,MES,D,,,,,BHU,VA,11260,VDHW,N23164888,E069395673,,N23164888,E069395673,E0000,00285,2,,,WGE,BHUJ,SMESD        BHU   VA111260VDHW N23164888E069395673    N23164888E069395673E0000002852     WGEBHUJ                          ,S,Simulation application continuation,SMESD        BHU   VA2S    UY                                             E000900285                                       
S,MES,D,,,,,BIA,VO,11680,VDHW,N13123290,E077414090,,N13123290,E077414090,W0020,03025,2,,,WGE,BENGALURU,SMESD        BIA   VO111680VDHW N13123290E077414090    N13123290E077414090W0020030252     WGEBENGALURU                     ,S,Simulation application continuation,SMESD        BIA   VO2S    UN                                             W001103025                                       
S,MES,D,,,,,BIG,LT,11690,VDHW,N40170380,E027215590,,N40170380,E027215590,E0050,00417,2,,461,WGE,BIGA,SMESD        BIG   LT111690VDHW N40170380E027215590    N40170380E027215590E0050004172  461WGEBIGA                          ,S,Simulation application continuation,SMESD        BIG   LT2S    UN                                             E005800417                                       
S,MES,D,,,,,BJD,OI,11350,VDHW,N32582070,E059120050,,N32582070,E059120050,E0030,05041,2,,468,WGE,BIRJAND,SMESD        BJD   OI111350VDHW N32582070E059120050    N32582070E059120050E0030050412  468WGEBIRJAND                       ,S,Simulation application continuation,SMESD        BJD   OI2S    UN                                             E0037                                            
S,MES,D,,,,,BKZ,LT,11730,VDH,N41073710,E029083440,,N41073710,E029083440,E0060,01073,2,,569,WGE,BEYKOZ,SMESD        BKZ   LT111730VDH  N41073710E029083440    N41073710E029083440E0060010732  569WGEBEYKOZ                        ,S,Simulation application continuation,SMESD        BKZ   LT2S    UN                                             E006101073                                       
S,MES,D,,,,,BND,OI,11720,VDUW,N27114940,E056220030,,N27114940,E056220030,E0020,00013,1,,338,WGE,BANDAR ABBAS,SMESD        BND   OI111720VDUW N27114940E056220030    N27114940E056220030E0020000131  338WGEBANDAR ABBAS                  ,S,Simulation application continuation,SMESD        BND   OI2S    UN                                             E002500013                                       
S,MES,D,,,,,BNG,LT,11210,VDHW,N38512000,E040360280,,N38512000,E040360280,E0060,03514,2,,189,WGE,BINGOL,SMESD        BNG   LT111210VDHW N38512000E040360280    N38512000E040360280E0060035142  189WGEBINGOL                        ,S,Simulation application continuation,SMESD        BNG   LT2S    UU                                             E006203514                                       
S,MES,D,,,,,BPL,VA,11710,VDHW,N23165970,E077201190,,N23165970,E077201190,W0000,01749,2,,,WGE,BHOPAL,SMESD        BPL   VA111710VDHW N23165970E077201190    N23165970E077201190W0000017492     WGEBHOPAL                        ,S,Simulation application continuation,SMESD        BPL   VA2S    UN                                             E000401749                                       
S,MES,D,,,,,BPN,OE,11370,VDLW,N27031400,E045264300,,N27031400,E045264300,E0040,00001,1,,,WGE,BOPAN,SMESD        BPN   OE111370VDLW N27031400E045264300    N27031400E045264300E0040000011     WGEBOPAN                         ,S,Simulation application continuation,SMESD        BPN   OE2S    UN                                             E003600001                                       
S,MES,D,,,,,BPN,VE,11600,VDHW,N25422650,E091584260,,N25422650,E091584260,W0000,02948,2,,531,WGE,BARAPANI,SMESD        BPN   VE111600VDHW N25422650E091584260    N25422650E091584260W0000029482  531WGEBARAPANI                      ,S,Simulation application continuation,SMESD        BPN   VE2S    UY                                             W000402948                                       
S,MES,D,,,,,BRD,OI,11480,VDHW,N37294220,E057192380,,N37294220,E057192380,E0050,03499,2,,415,WGE,BOJNORD,SMESD        BRD   OI111480VDHW N37294220E057192380    N37294220E057192380E0050034992  415WGEBOJNORD                       ,S,Simulation application continuation,SMESD        BRD   OI2S    UN                                             E005203499                                       
S,MES,D,,,,,BRI,LT,11225,VDLW,N39375430,E027554350,,N39375430,E027554350,E0050,00358,1,,445,WGE,BALIKESIR,SMESD        BRI   LT111225VDLW N39375430E027554350    N39375430E027554350E0050003581  445WGEBALIKESIR                     ,S,Simulation application continuation,SMESD        BRI   LT2S    UN                                             E0057                                            
S,MES,D,,,,,BRL,VI,11560,VDHW,N28250100,E079272500,,N28250100,E079272500,E0000,00571,2,,473,WGE,BAREILLY,SMESD        BRL   VI111560VDHW N28250100E079272500    N28250100E079272500E0000005712  473WGEBAREILLY                      ,S,Simulation application continuation,SMESD        BRL   VI2S    UY                                             E001100571                                       
S,MES,D,,,,,BRN,OI,11745,VDH,N32535150,E059165150,,N32535150,E059165150,E0030,04979,2,,495,WGE,BIRJAND,SMESD        BRN   OI111745VDH  N32535150E059165150    N32535150E059165150E0030049792  495WGEBIRJAND                       ,S,Simulation application continuation,SMESD        BRN   OI2S    UN                                             E003704979                                       
S,MES,D,,,,,BRT,VN,11410,VDHW,N26285800,E087145800,,N26285800,E087145800,W0000,00285,2,,,WGE,BIRATNAGAR,SMESD        BRT   VN111410VDHW N26285800E087145800    N26285800E087145800W0000002852     WGEBIRATNAGAR                    ,S,Simulation application continuation,SMESD        BRT   VN2S    UN                                             E000100285                                       
S,MES,D,,,,,BRY,LT,11530,VDHW,N40154510,E029353850,,N40154510,E029353850,E0040,00771,2,,246,WGE,YENISEHIR,SMESD        BRY   LT111530VDHW N40154510E029353850    N40154510E029353850E0040007712  246WGEYENISEHIR                     ,S,Simulation application continuation,SMESD        BRY   LT2S    UN                                             E005900771                                       
S,MES,D,,,,,BSA,LL,11430,VDHW,N31171010,E034431850,,N31171010,E034431850,E0050,00700,2,,242,WGE,BEER SHEBA,SMESD        BSA   LL111430VDHW N31171010E034431850    N31171010E034431850E0050007002  242WGEBEER SHEBA                    ,S,Simulation application continuation,SMESD        BSA   LL2S    UN                                             E004900700                                       
S,MES,D,,,,,BSH,OE,11230,VDHW,N19583960,E042372840,,N19583960,E042372840,E0020,03900,2,,555,WGE,BISHA,SMESD        BSH   OE111230VDHW N19583960E042372840    N19583960E042372840E0020039002  555WGEBISHA                         ,S,Simulation application continuation,SMESD        BSH   OE2S    UN                                             E0030                                            
S,MES,D,,,,,BSR,OR,11230,VDHW,N30313230,E047411210,,N30313230,E047411210,E0030,00100,2,,266,WGE,BASRAH,SMESD        BSR   OR111230VDHW N30313230E047411210    N30313230E047411210E0030001002  266WGEBASRAH                        ,S,Simulation application continuation,SMESD        BSR   OR2S    UN                                             E0040                                            
S,MES,D,,,,,BTR,OP,11460,VDHW,N33323954,E072512184,,N33323954,E072512184,E0030,01756,2,,370,WGE,ISLAMABAD,SMESD        BTR   OP111460VDHW N33323954E072512184    N33323954E072512184E0030017562  370WGEISLAMABAD                     ,S,Simulation application continuation,SMESD        BTR   OP2S    UN                                             E002801756                                       
S,MES,D,,,,,BUK,LT,11430,VDH,N40143070,E033061770,,N40143070,E033061770,E0060,04111,2,,302,WGE,CUBUK (ANKARA),SMESD        BUK   LT111430VDH  N40143070E033061770    N40143070E033061770E0060041112  302WGECUBUK (ANKARA)                ,S,Simulation application continuation,SMESD        BUK   LT2S    UN                                             E006204111                                       
S,MES,D,,,,,BUZ,OI,11745,VDHW,N28570470,E050493350,,N28570470,E050493350,E0030,00024,2,,495,WGE,BUSHEHR,SMESD        BUZ   OI111745VDHW N28570470E050493350    N28570470E050493350E0030000242  495WGEBUSHEHR                       ,S,Simulation application continuation,SMESD        BUZ   OI2S    UN                                             E003400024                                       
S,MES,D,,,,,BVR,VA,11410,VDHW,N21450230,E072112280,,N21450230,E072112280,W0000,00054,2,,,WGE,BHAVNAGAR,SMESD        BVR   VA111410VDHW N21450230E072112280    N21450230E072112280W0000000542     WGEBHAVNAGAR                     ,S,Simulation application continuation,SMESD        BVR   VA2S    UN                                             E000400054                                       
S,MES,D,,,,,BWA,VN,11700,VDHW,N27300300,E083262300,,N27300300,E083262300,E0000,00343,2,,359,WGE,BHAIRAHAWA,SMESD        BWA   VN111700VDHW N27300300E083262300    N27300300E083262300E0000003432  359WGEBHAIRAHAWA                    ,S,Simulation application continuation,SMESD        BWA   VN2S    UN                                             E000600343                                       
S,MES,D,,,,,CAK,OL,11620,VDHW,N34180181,E035415964,,N34180181,E035415964,E0050,00763,2,,341,WGE,CHEKA,SMESD        CAK   OL111620VDHW N34180181E035415964    N34180181E035415964E0050007632  341WGECHEKA                         ,S,Simulation application continuation,SMESD        CAK   OL2S    UN                                             E0053                                            
S,MES,D,,,,,CAY,LT,10960,VDH,N41304960,E032024040,,N41304960,E032024040,E0060,01709,2,,289,WGE,CAYCUMA,SMESD        CAY   LT110960VDH  N41304960E032024040    N41304960E032024040E0060017092  289WGECAYCUMA                       ,S,Simulation application continuation,SMESD        CAY   LT2S    UU                                             E006401709                                       
S,MES,D,,,,,CBH,OI,11560,VDUW,N25264190,E060245170,,N25264190,E060245170,E0010,00050,2,,,WGE,CHAH BAHAR,SMESD        CBH   OI111560VDUW N25264190E060245170    N25264190E060245170E0010000502     WGECHAH BAHAR                    ,S,Simulation application continuation,SMESD        CBH   OI2S    UN                                             E001900050                                       
S,MES,D,,,,,CCB,VO,11290,VDHW,N11015910,E077025510,,N11015910,E077025510,W0020,01312,2,,,WGE,COIMBATORE,SMESD        CCB   VO111290VDHW N11015910E077025510    N11015910E077025510W0020013122     WGECOIMBATORE                    ,S,Simulation application continuation,SMESD        CCB   VO2S    UN                                             W001401312                                       
S,MES,D,,,,,CEA,VE,11250,VDHW,N22403330,E088265320,,N22403330,E088265320,W0010,00047,2,,,WGE,KOLKATA,SMESD        CEA   VE111250VDHW N22403330E088265320    N22403330E088265320W0010000472     WGEKOLKATA                       ,S,Simulation application continuation,SMESD        CEA   VE2S    UN                                             W000300047                                       
S,MES,D,,,,,CEK,LT,11460,VDL,N41002360,E028314300,,N41002360,E028314300,E0060,00305,1,,415,WGE,CEKMECE,SMESD        CEK   LT111460VDL  N41002360E028314300    N41002360E028314300E0060003051  415WGECEKMECE                       ,S,Simulation application continuation,SMESD        CEK   LT2S    UN                                             E006000305                                       
S,MES,D,,,,,CHG,VI,11650,VDHW,N30405600,E076460030,,N30405600,E076460030,E0020,01048,2,,586,WGE,CHANDIGARH,SMESD        CHG   VI111650VDHW N30405600E076460030    N30405600E076460030E0020010482  586WGECHANDIGARH                    ,S,Simulation application continuation,SMESD        CHG   VI2S    UN                                             E001801048                                       
S,MES,D,,,,,CHI,VI,11680,VDHW,N28205109,E076395875,,N28205109,E076395875,E0010,00778,2,,,WGE,CHILLARKI,SMESD        CHI   VI111680VDHW N28205109E076395875    N28205109E076395875E0010007782     WGECHILLARKI                     ,S,Simulation application continuation,SMESD        CHI   VI2S    UN                                             E001300778                                       
S,MES,D,,,,,CIA,VO,11350,VDHW,N10090180,E076222130,,N10090180,E076222130,W0020,00046,2,,,WGE,COCHIN,SMESD        CIA   VO111350VDHW N10090180E076222130    N10090180E076222130W0020000462     WGECOCHIN                        ,S,Simulation application continuation,SMESD        CIA   VO2S    UY                                             W001500046                                       
S,MES,D,,,,,CIB,VO,11730,VDHW,N10070080,E076405010,,N10070080,E076405010,W0020,00155,2,,,WGE,COCHIN,SMESD        CIB   VO111730VDHW N10070080E076405010    N10070080E076405010W0020001552     WGECOCHIN                        ,S,Simulation application continuation,SMESD        CIB   VO2S    UY                                             W001500155                                       
S,MES,D,,,,,CKR,LT,11370,VDU,N36530320,E035040570,,N36530320,E035040570,E0060,00046,2,,393,WGE,CUKUROVA,SMESD        CKR   LT111370VDU  N36530320E035040570    N36530320E035040570E0060000462  393WGECUKUROVA                      ,S,Simulation application continuation,SMESD        CKR   LT2S    UN                                             E005700046                                       
S,MES,D,,,,,CLC,VO,11650,VDHW,N11080300,E075572370,,N11080300,E075572370,W0020,00353,2,,,WGE,CALICUT,SMESD        CLC   VO111650VDHW N11080300E075572370    N11080300E075572370W0020003532     WGECALICUT                       ,S,Simulation application continuation,SMESD        CLC   VO2S    UN                                             W001400353                                       
S,MES,D,,,,,CLD,LT,11385,VDH,N37485270,E027534700,,N37485270,E027534700,E0050,00121,2,,600,WGE,CILDIR (AYDIN),SMESD        CLD   LT111385VDH  N37485270E027534700    N37485270E027534700E0050001212  600WGECILDIR (AYDIN)                ,S,Simulation application continuation,SMESD        CLD   LT2S    UN                                             E005400121                                       
S,MES,D,,,,,CML,VG,11550,VDHW,N23260000,E091112490,,N23260000,E091112490,W0010,00047,2,,449,WGE,CUMILLA,SMESD        CML   VG111550VDHW N23260000E091112490    N23260000E091112490W0010000472  449WGECUMILLA                       ,S,Simulation application continuation,SMESD        CML   VG2S    UN                                             W000400047                                       
S,MES,D,,,,,CNI,VO,11490,VDHW,N13001550,E080095800,,N13001550,E080095800,W0020,00072,2,,,WGE,CHENNAI,SMESD        CNI   VO111490VDHW N13001550E080095800    N13001550E080095800W0020000722     WGECHENNAI                       ,S,Simulation application continuation,SMESD        CNI   VO2S    UY                                             W001100072                                       
S,MES,D,,,,,CNK,LT,11120,VDHW,N40080410,E026253560,,N40080410,E026253560,E0060,00046,2,,313,WGE,CANAKKALE,SMESD        CNK   LT111120VDHW N40080410E026253560    N40080410E026253560E0060000462  313WGECANAKKALE                     ,S,Simulation application continuation,SMESD        CNK   LT2S    UN                                             E0056                                            
S,MES,D,,,,,CRD,LT,11200,VDHW,N37472390,E029421450,,N37472390,E029421450,E0050,02808,2,,304,WGE,CARDAK,SMESD        CRD   LT111200VDHW N37472390E029421450    N37472390E029421450E0050028082  304WGECARDAK                        ,S,Simulation application continuation,SMESD        CRD   LT2S    UN                                             E005602808                                       
S,MES,D,,,,,CRL,LT,11480,VDHW,N41090270,E027560600,,N41090270,E027560600,E0050,00614,2,,238,WGE,CORLU,SMESD        CRL   LT111480VDHW N41090270E027560600    N41090270E027560600E0050006142  238WGECORLU                         ,S,Simulation application continuation,SMESD        CRL   LT2S    UN                                             E005900614                                       
S,MES,D,,,,,CRM,LT,11280,VDHW,N41155580,E036325590,,N41155580,E036325590,E0050,00033,2,,408,WGE,CARSAMBA (SAMSUN),SMESD        CRM   LT111280VDHW N41155580E036325590    N41155580E036325590E0050000332  408WGECARSAMBA (SAMSUN)             ,S,Simulation application continuation,SMESD        CRM   LT2S    UN                                             E006600033                                       
