S,EUR,D,,,,,FKS,ED,11750,VDHW,N49472750,E008323250,,N49472750,E008323250,E0020,00344,2,,309,WGE,FRANKENSTEIN,SEURD        FKS   ED111750VDHW N49472750E008323250    N49472750E008323250E0020003442  309WGEFRANKENSTEIN                  ,S,Simulation application continuation,SEURD        FKS   ED2S    UN                                             E003600344                                       
S,EUR,D,,,,,FLD,ED,11715,VDHW,N53454585,E013334729,,N53454585,E013334729,E0030,00121,2,,335,WGE,FRIEDLAND,SEURD        FLD   ED111715VDHW N53454585E013334729    N53454585E013334729E0030001212  335WGEFRIEDLAND                     ,S,Simulation application continuation,SEURD        FLD   ED2S    UN                                             E0052                                            
S,EUR,D,,,,,FLO,EB,11205,VDHA,N50523600,E005080430,,N50523600,E005080430,E0020,00100,2,,220,WGE,FLORA,SEURD        FLO   EB111205VDHA N50523600E005080430    N50523600E005080430E0020001002  220WGEFLORA                         ,S,Simulation application continuation,SEURD        FLO   EB2S    UN                                             E0027                                            
S,EUR,D,,,,,FLO,EN,11230,VDHW,N61345362,E005011266,,N61345362,E005011266,E0010,00069,2,,,WGE,FLORO,SEURD        FLO   EN111230VDHW N61345362E005011266    N61345362E005011266E0010000692     WGEFLORO                         ,S,Simulation application continuation,SEURD        FLO   EN2S    UU                                             E002600069                                       
S,EUR,D,,,,,FLS,EN,11555,VDHW,N60184054,E005124390,,N60184054,E005124390,E0010,00213,2,,445,WGE,FLESLAND,SEURD        FLS   EN111555VDHW N60184054E005124390    N60184054E005124390E0010002132  445WGEFLESLAND                      ,S,Simulation application continuation,SEURD        FLS   EN2S    UN                                             E002600213                                       
S,EUR,D,,,,,FMD,LO,11040,VDHW,N48061841,E016374535,,N48061841,E016374535,E0050,00639,2,,508,WGE,FISCHAMEND,SEURD        FMD   LO111040VDHW N48061841E016374535    N48061841E016374535E0050006392  508WGEFISCHAMEND                    ,S,Simulation application continuation,SEURD        FMD   LO2S    UN                                             E005300639                                       
S,EUR,D,,,,,FOL,LI,11575,VDH,N44113750,E012040360,,N44113710,E012040340,E0030,00112,2,,321,WGE,FORLI,SEURD        FOL   LI111575VDH  N44113750E012040360    N44113710E012040340E0030001122  321WGEFORLI                         ,S,Simulation application continuation,SEURD        FOL   LI2S    UY                                             E0040                                            
S,EUR,D,,,,,FRS,LI,11560,VDHW,N41383310,E013173250,,N41383330,E013173200,E0030,00620,2,,411,WGE,FROSINONE,SEURD        FRS   LI111560VDHW N41383310E013173250    N41383330E013173200E0030006202  411WGEFROSINONE                     ,S,Simulation application continuation,SEURD        FRS   LI2S    UN                                             E004100620                                       
S,EUR,D,,,,,FRS,LP,11330,VDHW,N39271290,W031123750,,N39271290,W031123760,W0130,02800,2,,,WGE,FLORES,SEURD        FRS   LP111330VDHW N39271290W031123750    N39271290W031123760W0130028002     WGEFLORES                        ,S,Simulation application continuation,SEURD        FRS   LP2S    UN                                             W0090                                            
S,EUR,D,,,,,FSK,LG,11640,VDHW,N41055537,E022592936,,N41055537,E022592936,E0050,01299,2,,281,WGE,FISKA,SEURD        FSK   LG111640VDHW N41055537E022592936    N41055537E022592936E0050012992  281WGEFISKA                         ,S,Simulation application continuation,SEURD        FSK   LG2S    UN                                             E0054                                            
S,EUR,D,,,,,FTM,LP,11350,VDHW,N39395650,W008293350,,N39395790,W008293560,W0020,00700,2,,359,WGE,FATIMA,SEURD        FTM   LP111350VDHW N39395650W008293350    N39395790W008293560W0020007002  359WGEFATIMA                        ,S,Simulation application continuation,SEURD        FTM   LP2S    UN                                             W000900700                                       
S,EUR,D,,,,,FUL,ED,11210,VDHW,N50353284,E009341981,,N50353284,E009341981,E0020,01116,2,,416,WGE,FULDA,SEURD        FUL   ED111210VDHW N50353284E009341981    N50353284E009341981E0020011162  416WGEFULDA                         ,S,Simulation application continuation,SEURD        FUL   ED2S    UN                                             E0039                                            
S,EUR,D,,,,,FUN,LP,11220,VDHW,N32444980,W016421960,,N32444930,W016422050,W0040,00500,2,,,WGE,FUNCHAL,SEURD        FUN   LP111220VDHW N32444980W016421960    N32444930W016422050W0040005002     WGEFUNCHAL                       ,S,Simulation application continuation,SEURD        FUN   LP2S    UN                                             W003600500                                       
S,EUR,D,,,,,FWE,ED,11330,VDHW,N52244079,E014075012,,N52244079,E014075012,E0040,00224,2,,339,WGE,FUERSTENWALDE,SEURD        FWE   ED111330VDHW N52244079E014075012    N52244079E014075012E0040002242  339WGEFUERSTENWALDE                 ,S,Simulation application continuation,SEURD        FWE   ED2S    UN                                             E005200224                                       
S,EUR,D,,,,,GAM,EG,11280,VDH,N53165328,W000564979,,N53165328,W000564979,E0000,00115,2,,294,WGE,GAMSTON,SEURD        GAM   EG111280VDH  N53165328W000564979    N53165328W000564979E0000001152  294WGEGAMSTON                       ,S,Simulation application continuation,SEURD        GAM   EG2S    UN                                             E000600115                                       
S,EUR,D,,,,,GAR,LG,10880,VDLW,N39362308,E019543390,,N39362308,E019543390,E0050,00033,1,,229,WGE,GARITSA (KERKIRA),SEURD        GAR   LG110880VDLW N39362308E019543390    N39362308E019543390E0050000331  229WGEGARITSA (KERKIRA)             ,S,Simulation application continuation,SEURD        GAR   LG2S    UN                                             E0048                                            
S,EUR,D,,,,,GDA,LE,11340,VDHW,N37105940,W003592730,,N37105990,W003592730,W0000,01969,2,,,WGE,GRANADA,SEURD        GDA   LE111340VDHW N37105940W003592730    N37105990W003592730W0000019692     WGEGRANADA                       ,S,Simulation application continuation,SEURD        GDA   LE2S    UN                                             E0004                                            
S,EUR,D,,,,,GDC,LI,11335,VDLW,N40464486,E016551643,,N40464486,E016551643,E0040,01124,1,,461,WGE,GIOIA DEL COLLE,SEURD        GDC   LI111335VDLW N40464486E016551643    N40464486E016551643E0040011241  461WGEGIOIA DEL COLLE               ,S,Simulation application continuation,SEURD        GDC   LI2S    UN                                             E004601124                                       
S,EUR,D,,,,,GEN,LI,11280,VDHW,N44252800,E009045640,,N44252800,E009045720,E0030,02930,2,,263,WGE,GENOA,SEURD        GEN   LI111280VDHW N44252800E009045640    N44252800E009045720E0030029302  263WGEGENOA                         ,S,Simulation application continuation,SEURD        GEN   LI2S    UN                                             E003502930                                       
S,EUR,D,,,,,GIR,LE,11410,VDLW,N41555250,E002461870,,N41555300,E002461850,E0020,00492,1,,385,WGE,GERONA (GIRONA),SEURD        GIR   LE111410VDLW N41555250E002461870    N41555300E002461850E0020004921  385WGEGERONA (GIRONA)               ,S,Simulation application continuation,SEURD        GIR   LE2S    UN                                             E002100492                                       
S,EUR,D,,,,,GMH,ED,11540,VDH,N51101384,E007533134,,N51101384,E007533134,E0030,01814,2,,221,WGE,GERMINGHAUSEN,SEURD        GMH   ED111540VDH  N51101384E007533134    N51101384E007533134E0030018142  221WGEGERMINGHAUSEN                 ,S,Simulation application continuation,SEURD        GMH   ED2S    UN                                             E0034                                            
S,EUR,D,,,,,GOS,EB,11570,VDH,N50280070,E004285260,,N50280070,E004285260,E0010,00600,2,,276,WGE,GOSLY,SEURD        GOS   EB111570VDH  N50280070E004285260    N50280070E004285260E0010006002  276WGEGOSLY                         ,S,Simulation application continuation,SEURD        GOS   EB2S    UN                                             E0025                                            
S,EUR,D,,,,,GOT,ED,11525,VDHW,N51203522,E011355110,,N51203522,E011355110,E0020,00791,2,,441,WGE,GOTEM,SEURD        GOT   ED111525VDHW N51203522E011355110    N51203522E011355110E0020007912  441WGEGOTEM                         ,S,Simulation application continuation,SEURD        GOT   ED2S    UN                                             E0045                                            
S,EUR,D,,,,,GOW,EG,11540,VDL,N55521381,W004264460,,N55521381,W004264460,W0010,00046,1,,522,WGE,GLASGOW,SEURD        GOW   EG111540VDL  N55521381W004264460    N55521381W004264460W0010000461  522WGEGLASGOW                       ,S,Simulation application continuation,SEURD        GOW   EG2S    UN                                             W001000046                                       
S,EUR,D,,,,,GRM,EN,11595,VDLW,N60113033,E011042791,,N60113033,E011042791,E0040,00683,1,,,WGE,GARDERMOEN,SEURD        GRM   EN111595VDLW N60113033E011042791    N60113033E011042791E0040006831     WGEGARDERMOEN                    ,S,Simulation application continuation,SEURD        GRM   EN2S    UN                                             E005100683                                       
S,EUR,D,,,,,GRO,LI,10985,VTHW,N42453920,E011043830,,N42453720,E011043860,E0030,00079,2,,275,WGE,GROSSETO,SEURD        GRO   LI110985VTHW N42453920E011043830    N42453720E011043860E0030000792  275WGEGROSSETO                      ,S,Simulation application continuation,SEURD        GRO   LI2S    UN                                             E003800075                                       
S,EUR,D,,,,,GRZ,LO,11620,VDHW,N46571912,E015265800,,N46571953,E015265789,E0050,01094,2,,213,WGE,GRAZ,SEURD        GRZ   LO111620VDHW N46571912E015265800    N46571953E015265789E0050010942  213WGEGRAZ                          ,S,Simulation application continuation,SEURD        GRZ   LO2S    UN                                             E004901094                                       
S,EUR,D,,,,,GTQ,LF,11125,VDHW,N48591120,E006425840,,N48591120,E006425840,E0020,01057,2,,384,WGE,GROSTENQUIN,SEURD        GTQ   LF111125VDHW N48591120E006425840    N48591120E006425840E0020010572  384WGEGROSTENQUIN                   ,S,Simulation application continuation,SEURD        GTQ   LF2S    UN                                             E003101057                                       
S,EUR,D,,,,,GUR,EG,10940,VDHA,N49261355,W002361372,,N49261355,W002361372,W0010,00343,2,,441,WGE,GUERNSEY,SEURD        GUR   EG110940VDHA N49261355W002361372    N49261355W002361372W0010003432  441WGEGUERNSEY                      ,S,Simulation application continuation,SEURD        GUR   EG2S    UN                                             E000400343                                       
S,EUR,D,,,,,GWC,EG,11475,VDL,N50511879,W000452425,,N50511879,W000452425,E0010,00122,1,,385,WGE,GOODWOOD,SEURD        GWC   EG111475VDL  N50511879W000452425    N50511879W000452425E0010001221  385WGEGOODWOOD                      ,S,Simulation application continuation,SEURD        GWC   EG2S    UN                                             E0008                                            
S,EUR,D,,,,,GZO,LM,11570,VDHW,N36021443,E014121895,,N36021443,E014121895,E0030,00522,2,,382,WGE,GOZO,SEURD        GZO   LM111570VDHW N36021443E014121895    N36021443E014121895E0030005222  382WGEGOZO                          ,S,Simulation application continuation,SEURD        GZO   LM2S    UN                                             E003800522                                       
S,EUR,D,,,,,HAM,ED,11310,VDHW,N53410807,E010121799,,N53410807,E010121799,E0040,00166,2,,253,WGE,HAMBURG,SEURD        HAM   ED111310VDHW N53410807E010121799    N53410807E010121799E0040001662  253WGEHAMBURG                       ,S,Simulation application continuation,SEURD        HAM   ED2S    UN                                             E004200166                                       
S,EUR,D,,,,,HDO,ED,10865,VDHW,N50554134,E014220768,,N50554134,E014220768,E0030,01433,2,,256,WGE,HERMSDORF,SEURD        HDO   ED110865VDHW N50554134E014220768    N50554134E014220768E0030014332  256WGEHERMSDORF                     ,S,Simulation application continuation,SEURD        HDO   ED2S    UN                                             E0051                                            
S,EUR,D,,,,,HEL,EF,11420,VDHW,N60201614,E024571343,,N60201614,E024571343,E0100,00239,2,,369,WGE,HELSINKI,SEURD        HEL   EF111420VDHW N60201614E024571343    N60201614E024571343E0100002392  369WGEHELSINKI                      ,S,Simulation application continuation,SEURD        HEL   EF2S    UY                                             E010400239                                       
S,EUR,D,,,,,HIJ,LE,11470,VDHW,N38302930,W005055890,,N38302930,W005055890,W0000,01870,2,,587,WGE,HINOJOSA DEL DUQUE,SEURD        HIJ   LE111470VDHW N38302930W005055890    N38302930W005055890W0000018702  587WGEHINOJOSA DEL DUQUE            ,S,Simulation application continuation,SEURD        HIJ   LE2S    UN                                             E0001                                            
S,EUR,D,,,,,HLZ,ED,11730,VDHW,N52214822,E010474279,,N52214822,E010474279,E0020,00404,2,,342,WGE,HEHLINGEN,SEURD        HLZ   ED111730VDHW N52214822E010474279    N52214822E010474279E0020004042  342WGEHEHLINGEN                     ,S,Simulation application continuation,SEURD        HLZ   ED2S    UN                                             E004300404                                       
S,EUR,D,,,,,HMF,EN,11240,VDHW,N70421528,E023412668,,N70421528,E023412668,E0130,01255,2,,,WGE,HAMMERFEST,SEURD        HMF   EN111240VDHW N70421528E023412668    N70421528E023412668E0130012552     WGEHAMMERFEST                    ,S,Simulation application continuation,SEURD        HMF   EN2S    UN                                             E014101255                                       
S,EUR,D,,,,,HMM,ED,11565,VDHA,N51512472,E007422986,,N51512472,E007422986,E0010,00217,2,,302,WGE,HAMM,SEURD        HMM   ED111565VDHA N51512472E007422986    N51512472E007422986E0010002172  302WGEHAMM                          ,S,Simulation application continuation,SEURD        HMM   ED2S    UN                                             E0034                                            
S,EUR,D,,,,,HMR,ES,11260,VDHW,N60164520,E018232960,,N60164520,E018232960,E0060,00099,2,,350,WGE,HAMMAR,SEURD        HMR   ES111260VDHW N60164520E018232960    N60164520E018232960E0060000992  350WGEHAMMAR                        ,S,Simulation application continuation,SEURD        HMR   ES2S    UN                                             E007900099                                       
S,EUR,D,,,,,HON,EG,11365,VDH,N52212404,W001394941,,N52212404,W001394941,E0010,00435,2,,382,WGE,HONILEY,SEURD        HON   EG111365VDH  N52212404W001394941    N52212404W001394941E0010004352  382WGEHONILEY                       ,S,Simulation application continuation,SEURD        HON   EG2S    UN                                             E0004                                            
S,EUR,D,,,,,HOS,LG,11080,VDH,N38205816,E026083375,,N38205816,E026083375,E0060,00026,2,,196,WGE,CHIOS,SEURD        HOS   LG111080VDH  N38205816E026083375    N38205816E026083375E0060000262  196WGECHIOS                         ,S,Simulation application continuation,SEURD        HOS   LG2S    UN                                             E005400026                                       
S,EUR,D,,,,,HUE,LE,11455,VDH,N42042410,W000190770,,N42042430,W000190840,E0010,01772,2,,590,WGE,HUESCA,SEURD        HUE   LE111455VDH  N42042410W000190770    N42042430W000190840E0010017722  590WGEHUESCA                        ,S,Simulation application continuation,SEURD        HUE   LE2S    UN                                             E0013                                            
S,EUR,D,,,,,HUL,EB,11755,VDHA,N50445810,E004382990,,N50445810,E004382990,E0010,00400,2,,,WGE,HULDENBERG,SEURD        HUL   EB111755VDHA N50445810E004382990    N50445810E004382990E0010004002     WGEHULDENBERG                    ,S,Simulation application continuation,SEURD        HUL   EB2S    UN                                             E0025                                            
S,EUR,D,,,,,IBA,LE,11780,VDHW,N38520600,E001215740,,N38520630,E001215790,E0010,00001,2,,383,WGE,IBIZA,SEURD        IBA   LE111780VDHW N38520600E001215740    N38520630E001215790E0010000012  383WGEIBIZA                         ,S,Simulation application continuation,SEURD        IBA   LE2S    UN                                             E001700001                                       
S,EUR,D,,,,,ILB,LJ,11480,VDH,N45335611,E014101511,,N45335611,E014101511,E0040,01961,2,,327,WGE,BISTRICA,SEURD        ILB   LJ111480VDH  N45335611E014101511    N45335611E014101511E0040019612  327WGEBISTRICA                      ,S,Simulation application continuation,SEURD        ILB   LJ2S    UU                                             E0045                                            
S,EUR,D,,,,,ING,BI,11240,VDL,N63481100,W016381700,,N63481100,W016381700,W0110,00200,1,,,WGE,INGO,SEURD        ING   BI111240VDL  N63481100W016381700    N63481100W016381700W0110002001     WGEINGO                          ,S,Simulation application continuation,SEURD        ING   BI2S    UN                                             W008500200                                       
S,EUR,D,,,,,INS,EG,10920,VDL,N57323349,W004022799,,N57323349,W004022799,W0010,00042,1,,,WGE,INVERNESS,SEURD        INS   EG110920VDL  N57323349W004022799    N57323349W004022799W0010000421     WGEINVERNESS                     ,S,Simulation application continuation,SEURD        INS   EG2S    UN                                             W0011                                            
S,EUR,D,,,,,IOM,EG,11220,VDHW,N54040112,W004454850,,N54040112,W004454850,W0010,00567,2,,308,WGE,ISLE OF MAN,SEURD        IOM   EG111220VDHW N54040112W004454850    N54040112W004454850W0010005672  308WGEISLE OF MAN                   ,S,Simulation application continuation,SEURD        IOM   EG2S    UN                                             W0009                                            
S,EUR,D,,,,,IRA,LG,10880,VDHW,N35202668,E025110652,,N35202668,E025110652,E0050,00116,2,,335,WGE,IRAKLION,SEURD        IRA   LG110880VDHW N35202668E025110652    N35202668E025110652E0050001162  335WGEIRAKLION                      ,S,Simulation application continuation,SEURD        IRA   LG2S    UN                                             E004900116                                       
S,EUR,D,,,,,JOA,LE,11770,VDLW,N39335280,E002444790,,N39335330,E002444780,E0010,00001,1,,255,WGE,PALMA SON SANT JOAN,SEURD        JOA   LE111770VDLW N39335280E002444790    N39335330E002444780E0010000011  255WGEPALMA SON SANT JOAN           ,S,Simulation application continuation,SEURD        JOA   LE2S    UN                                             E0020                                            
S,EUR,D,,,,,JON,ES,11580,VDH,N57453760,E014035550,,N57453760,E014035550,E0070,00782,2,,283,WGE,JONKOPING,SEURD        JON   ES111580VDH  N57453760E014035550    N57453760E014035550E0070007822  283WGEJONKOPING                     ,S,Simulation application continuation,SEURD        JON   ES2S    UN                                             E005900782                                       
S,EUR,D,,,,,JRZ,LE,11300,VDHW,N36485470,W006013550,,N36485490,W006013470,W0010,00295,2,,255,WGE,JEREZ,SEURD        JRZ   LE111300VDHW N36485470W006013550    N36485490W006013470W0010002952  255WGEJEREZ                         ,S,Simulation application continuation,SEURD        JRZ   LE2S    UN                                             W0001                                            
S,EUR,D,,,,,JSY,EG,11220,VDH,N49131598,W002024612,,N49131598,W002024612,W0010,00276,2,,308,WGE,JERSEY,SEURD        JSY   EG111220VDH  N49131598W002024612    N49131598W002024612W0010002762  308WGEJERSEY                        ,S,Simulation application continuation,SEURD        JSY   EG2S    UN                                             E0005                                            
S,EUR,D,,,,,KAL,ES,11160,VDHW,N56410720,E016170280,,N56410720,E016170280,E0060,00026,2,,,WGE,KALMAR,SEURD        KAL   ES111160VDHW N56410720E016170280    N56410720E016170280E0060000262     WGEKALMAR                        ,S,Simulation application continuation,SEURD        KAL   ES2S    UN                                             E0064                                            
S,EUR,D,,,,,KAM,LG,11260,VDHW,N37035921,E022012613,,N37035921,E022012613,E0050,00045,2,,344,WGE,KALAMATA,SEURD        KAM   LG111260VDHW N37035921E022012613    N37035921E022012613E0050000452  344WGEKALAMATA                      ,S,Simulation application continuation,SEURD        KAM   LG2S    UN                                             E004800045                                       
S,EUR,D,,,,,KAS,LG,11450,VDH,N40270368,E021163115,,N40270368,E021163115,E0050,02181,2,,517,WGE,KASTORIA,SEURD        KAS   LG111450VDH  N40270368E021163115    N40270368E021163115E0050021812  517WGEKASTORIA                      ,S,Simulation application continuation,SEURD        KAS   LG2S    UN                                             E0051                                            
S,EUR,D,,,,,KBO,ED,11215,VDLA,N50514204,E007084386,,N50514204,E007084386,E0030,00292,1,,194,WGE,COLOGNE-BONN,SEURD        KBO   ED111215VDLA N50514204E007084386    N50514204E007084386E0030002921  194WGECOLOGNE-BONN                  ,S,Simulation application continuation,SEURD        KBO   ED2S    UN                                             E003200292                                       
S,EUR,D,,,,,KEA,LG,11500,VDHW,N37332579,E024175532,,N37332579,E024175532,E0050,01399,2,,474,WGE,KEA,SEURD        KEA   LG111500VDHW N37332579E024175532    N37332579E024175532E0050013992  474WGEKEA                           ,S,Simulation application continuation,SEURD        KEA   LG2S    UN                                             E005101399                                       
S,EUR,D,,,,,KEB,LQ,11670,VDH,N43560191,E018265938,,N43560191,E018265938,E0050,05056,2,,438,WGE,SARAJEVO,SEURD        KEB   LQ111670VDH  N43560191E018265938    N43560191E018265938E0050050562  438WGESARAJEVO                      ,S,Simulation application continuation,SEURD        KEB   LQ2S    UN                                             E0051                                            
S,EUR,D,,,,,KFN,LG,11550,VDHW,N38064663,E020301686,,N38064663,E020301686,E0050,00068,2,,,WGE,KEFALLINIA,SEURD        KFN   LG111550VDHW N38064663E020301686    N38064663E020301686E0050000682     WGEKEFALLINIA                    ,S,Simulation application continuation,SEURD        KFN   LG2S    UY                                             E0047                                            
S,EUR,D,,,,,KFT,LO,11310,VDHW,N46355131,E014334436,,N46355187,E014334449,E0040,02278,2,,223,WGE,KLAGENFURT,SEURD        KFT   LO111310VDHW N46355131E014334436    N46355187E014334449E0040022782  223WGEKLAGENFURT                    ,S,Simulation application continuation,SEURD        KFT   LO2S    UN                                             E004702278                                       
S,EUR,D,,,,,KFV,BI,11280,VTHW,N63585840,W022365450,,N63585840,W022365450,W0120,00200,2,,,WGE,KEFLAVIK,SEURD        KFV   BI111280VTHW N63585840W022365450    N63585840W022365450W0120002002     WGEKEFLAVIK                      ,S,Simulation application continuation,SEURD        KFV   BI2S    UY                                             W0117                                            
S,EUR,D,,,,,KIK,EN,11200,VDTW,N69432565,E029520880,,N69432565,E029520880,E0160,00301,0,,452,WGE,KIRKENES,SEURD        KIK   EN111200VDTW N69432565E029520880    N69432565E029520880E0160003010  452WGEKIRKENES                      ,S,Simulation application continuation,SEURD        KIK   EN2S    UN                                             E016900301                                       
S,EUR,D,,,,,KIS,LQ,11600,VDL,N44010579,E018034679,,N44010579,E018034679,E0050,02521,1,,263,WGE,SARAJEVO,SEURD        KIS   LQ111600VDL  N44010579E018034679    N44010579E018034679E0050025211  263WGESARAJEVO                      ,S,Simulation application continuation,SEURD        KIS   LQ2S    UN                                             E0051                                            
S,EUR,D,,,,,KLF,ED,11515,VDHW,N52010967,E013334829,,N52010967,E013334829,E0040,00223,2,,257,WGE,KLASDORF,SEURD        KLF   ED111515VDHW N52010967E013334829    N52010967E013334829E0040002232  257WGEKLASDORF                      ,S,Simulation application continuation,SEURD        KLF   ED2S    UN                                             E005000223                                       
S,EUR,D,,,,,KLO,LS,11485,VDUW,N47272570,E008324410,,N47272570,E008324410,E0030,01410,2,,242,WGE,KLOTEN (ZURICH),SEURD        KLO   LS111485VDUW N47272570E008324410    N47272570E008324410E0030014102  242WGEKLOTEN (ZURICH)               ,S,Simulation application continuation,SEURD        KLO   LS2S    UN                                             E003501410                                       
