S,EEU,D,,,,,PKK,UH,11370,VDHW,N53114110,E158260590,,N53114110,E158260590,W0070,00098,2,,,WGE,YELIZOVO,SEEUD        PKK   UH111370VDHW N53114110E158260590    N53114110E158260590W0070000982     WGEYELIZOVO                      ,S,Simulation application continuation,SEEUD        PKK   UH2S    UN                                             W007500098                                       
S,EEU,D,,,,,PLR,UE,11290,VDHW,N66243000,E112013740,,N66243000,E112013740,W0110,01772,2,,394,WGE,POLIARNY,SEEUD        PLR   UE111290VDHW N66243000E112013740    N66243000E112013740W0110017722  394WGEPOLIARNY                      ,S,Simulation application continuation,SEEUD        PLR   UE2S    UN                                             W011101772                                       
S,EEU,D,,,,,PLT,ZS,11160,VDHW,N25483000,E114523000,,N25483000,E114523000,W0030,00535,2,,,WGE,PANLONG,SEEUD        PLT   ZS111160VDHW N25483000E114523000    N25483000E114523000W0030005352     WGEPANLONG                       ,S,Simulation application continuation,SEEUD        PLT   ZS2S    UN                                             W004100535                                       
S,EEU,D,,,,,PNZ,UW,11380,VDHW,N53064990,E045010360,,N53064990,E045010360,E0120,00600,2,,564,WGE,PENZA,SEEUD        PNZ   UW111380VDHW N53064990E045010360    N53064990E045010360E0120006002  564WGEPENZA                         ,S,Simulation application continuation,SEEUD        PNZ   UW2S    UN                                             E011900600                                       
S,EEU,D,,,,,POU,ZG,11410,VDHW,N23011800,E113112400,,N23011800,E113112400,W0030,00089,2,,469,WGE,PINGZHOU,SEEUD        POU   ZG111410VDHW N23011800E113112400    N23011800E113112400W0030000892  469WGEPINGZHOU                      ,S,Simulation application continuation,SEEUD        POU   ZG2S    UN                                             W003200089                                       
S,EEU,D,,,,,PPD,LZ,11210,VDH,N49035280,E020210040,,N49035280,E020210040,E0060,02382,2,,427,WGE,TATRY,SEEUD        PPD   LZ111210VDH  N49035280E020210040    N49035280E020210040E0060023822  427WGETATRY                         ,S,Simulation application continuation,SEEUD        PPD   LZ2S    UN                                             E006202382                                       
S,EEU,D,,,,,PSK,UA,11250,VDH,N54470290,E069130870,,N54470290,E069130870,E0120,00500,2,,500,WGE,PETROPAVLOVSK,SEEUD        PSK   UA111250VDH  N54470290E069130870    N54470290E069130870E0120005002  500WGEPETROPAVLOVSK                 ,S,Simulation application continuation,SEEUD        PSK   UA2S    UN                                             E012900500                                       
S,EEU,D,,,,,PTB,LH,11710,VDH,N47090800,E018443200,,N47090800,E018443200,E0050,00430,2,,349,WGE,PUSZTASZABOLCS,SEEUD        PTB   LH111710VDH  N47090800E018443200    N47090800E018443200E0050004302  349WGEPUSZTASZABOLCS                ,S,Simulation application continuation,SEEUD        PTB   LH2S    UN                                             E005600430                                       
S,EEU,D,,,,,PTG,UN,11340,VDHW,N61355590,E090004800,,N61355550,E090004800,E0080,00200,2,,,WGE,PODKAMENNAYA TUNGUSKA,SEEUD        PTG   UN111340VDHW N61355590E090004800    N61355550E090004800E0080002002     WGEPODKAMENNAYA TUNGUSKA         ,S,Simulation application continuation,SEEUD        PTG   UN2S    UN                                             E007400200                                       
S,EEU,D,,,,,PTR,UH,11060,VDHW,N45145120,E147585040,,N45145120,E147585040,W0080,00394,2,,,WGE,ITURUP,SEEUD        PTR   UH111060VDHW N45145120E147585040    N45145120E147585040W0080003942     WGEITURUP                        ,S,Simulation application continuation,SEEUD        PTR   UH2S    UN                                             W009000394                                       
S,EEU,D,,,,,PTZ,UL,10925,VDHW,N61531550,E034093970,,N61531550,E034093970,E0140,00200,2,,,WGE,PETROZAVODSK,SEEUD        PTZ   UL110925VDHW N61531550E034093970    N61531550E034093970E0140002002     WGEPETROZAVODSK                  ,S,Simulation application continuation,SEEUD        PTZ   UL2S    UN                                             E014300200                                       
S,EEU,D,,,,,PUD,ZS,11690,VDHW,N31101800,E121470000,,N31101800,E121470000,W0060,00049,2,,441,WGE,PUDONG,SEEUD        PUD   ZS111690VDHW N31101800E121470000    N31101800E121470000W0060000492  441WGEPUDONG                        ,S,Simulation application continuation,SEEUD        PUD   ZS2S    UN                                             W006600049                                       
S,EEU,D,,,,,PVL,UA,11400,VDHW,N52123460,E077054210,,N52123460,E077054210,E0090,00500,2,,578,WGE,PAVLODAR,SEEUD        PVL   UA111400VDHW N52123460E077054210    N52123460E077054210E0090005002  578WGEPAVLODAR                      ,S,Simulation application continuation,SEEUD        PVL   UA2S    UN                                             E009100500                                       
S,EEU,D,,,,,PWK,UH,11000,VDHW,N69480870,E170353060,,N69480870,E170353060,W0040,00001,2,,521,WGE,PEVEK,SEEUD        PWK   UH111000VDHW N69480870E170353060    N69480870E170353060W0040000012  521WGEPEVEK                         ,S,Simulation application continuation,SEEUD        PWK   UH2S    UN                                             W005700001                                       
S,EEU,D,,,,,QBL,UB,11250,VDHW,N40495660,E047430580,,N40495660,E047430580,E0060,01300,2,,505,WGE,GABALA,SEEUD        QBL   UB111250VDHW N40495660E047430580    N40495660E047430580E0060013002  505WGEGABALA                        ,S,Simulation application continuation,SEEUD        QBL   UB2S    UU                                             E0067                                            
S,EEU,D,,,,,QJG,ZU,11270,VDHW,N29030600,E106395400,,N29030600,E106395400,W0030,01398,2,,488,WGE,QIJIANG,SEEUD        QJG   ZU111270VDHW N29030600E106395400    N29030600E106395400W0030013982  488WGEQIJIANG                       ,S,Simulation application continuation,SEEUD        QJG   ZU2S    UN                                             W002801398                                       
S,EEU,D,,,,,QNX,ZU,11310,VDHW,N27023000,E106014800,,N27023000,E106014800,W0020,00001,2,,499,WGE,QIANXI,SEEUD        QNX   ZU111310VDHW N27023000E106014800    N27023000E106014800W0020000012  499WGEQIANXI                        ,S,Simulation application continuation,SEEUD        QNX   ZU2S    UN                                             W0025                                            
S,EEU,D,,,,,QTV,ZW,11210,VDHW,N43591800,E089364200,,N43591800,E089364200,E0020,02000,2,,,WGE,QITAI,SEEUD        QTV   ZW111210VDHW N43591800E089364200    N43591800E089364200E0020020002     WGEQITAI                         ,S,Simulation application continuation,SEEUD        QTV   ZW2S    UY                                             E0019                                            
S,EEU,D,,,,,RDO,EP,11385,VDH,N51235990,E021155660,,N51235990,E021155660,E0070,00600,2,,378,WGE,RADOM (WARSAW),SEEUD        RDO   EP111385VDH  N51235990E021155660    N51235990E021155660E0070006002  378WGERADOM (WARSAW)                ,S,Simulation application continuation,SEEUD        RDO   EP2S    UN                                             E006800600                                       
S,EEU,D,,,,,RG,UW,11230,VDH,N54322220,E055531300,,N54322220,E055531300,E0130,00492,2,,442,WGE,UFA,SEEUD        RG    UW111230VDH  N54322220E055531300    N54322220E055531300E0130004922  442WGEUFA                           ,S,Simulation application continuation,SEEUD        RG    UW2S    UU                                             E013800492                                       
S,EEU,D,,,,,RIA,EV,11400,VDHW,N56551510,E023575470,,N56551510,E023575470,E0100,00100,2,,442,WGE,RIGA,SEEUD        RIA   EV111400VDHW N56551510E023575470    N56551510E023575470E0100001002  442WGERIGA                          ,S,Simulation application continuation,SEEUD        RIA   EV2S    UN                                             E008900100                                       
S,EEU,D,,,,,RK,UW,11300,VDHW,N51423770,E046110530,,N51423770,E046110530,E0110,00100,2,,426,WGE,GAGARIN,SEEUD        RK    UW111300VDHW N51423770E046110530    N51423770E046110530E0110001002  426WGEGAGARIN                       ,S,Simulation application continuation,SEEUD        RK    UW2S    UN                                             E011300100                                       
S,EEU,D,,,,,RKN,UE,11580,VDHW,N68443600,E161203600,,N68443600,E161203600,W0100,00098,2,,,WGE,CHERSKY,SEEUD        RKN   UE111580VDHW N68443600E161203600    N68443600E161203600W0100000982     WGECHERSKY                       ,S,Simulation application continuation,SEEUD        RKN   UE2S    UN                                             W009900098                                       
S,EEU,D,,,,,RKZ,ZU,11350,VDHW,N29211800,E089161800,,N29211800,E089161800,E0000,12484,2,,578,WGE,RIKAZE,SEEUD        RKZ   ZU111350VDHW N29211800E089161800    N29211800E089161800E0000124842  578WGERIKAZE                        ,S,Simulation application continuation,SEEUD        RKZ   ZU2S    UN                                             E000212484                                       
S,EEU,D,,,,,ROS,UR,11700,VDHW,N47300320,E039560080,,N47300320,E039560080,E0080,00300,2,,361,WGE,PLATOV (ROSTOV-NA-DONU),SEEUD        ROS   UR111700VDHW N47300320E039560080    N47300320E039560080E0080003002  361WGEPLATOV (ROSTOV-NA-DONU)       ,S,Simulation application continuation,SEEUD        ROS   UR2S    UY                                             E008700300                                       
S,EEU,D,,,,,RSW,EP,11060,VDH,N50063100,E022080250,,N50063100,E022080250,E0060,00700,2,,,WGE,LUKAWIEC,SEEUD        RSW   EP111060VDH  N50063100E022080250    N50063100E022080250E0060007002     WGELUKAWIEC                      ,S,Simulation application continuation,SEEUD        RSW   EP2S    UN                                             E006700700                                       
S,EEU,D,,,,,RT,UU,11790,VDHW,N55324430,E038093710,,N55324430,E038093710,E0120,00394,2,,,WGE,RAMENSKOYE,SEEUD        RT    UU111790VDHW N55324430E038093710    N55324430E038093710E0120003942     WGERAMENSKOYE                    ,S,Simulation application continuation,SEEUD        RT    UU2S    UN                                             E012000394                                       
S,EEU,D,,,,,RUD,EP,11510,VDHW,N52495000,E023422600,,N52495000,E023422600,E0060,00600,2,,343,WGE,SKUPOWO,SEEUD        RUD   EP111510VDHW N52495000E023422600    N52495000E023422600E0060006002  343WGESKUPOWO                       ,S,Simulation application continuation,SEEUD        RUD   EP2S    UN                                             E007700600                                       
S,EEU,D,,,,,SAG,LH,11440,VDH,N48002900,E020594700,,N48002900,E020594700,E0060,00371,2,,389,WGE,SAJOHIDVEG,SEEUD        SAG   LH111440VDH  N48002900E020594700    N48002900E020594700E0060003712  389WGESAJOHIDVEG                    ,S,Simulation application continuation,SEEUD        SAG   LH2S    UN                                             E006100371                                       
S,EEU,D,,,,,SAO,UU,11630,VDHW,N55043100,E033182800,,N55043100,E033182800,E0100,00886,2,,340,WGE,SAFONOVO,SEEUD        SAO   UU111630VDHW N55043100E033182800    N55043100E033182800E0100008862  340WGESAFONOVO                      ,S,Simulation application continuation,SEEUD        SAO   UU2S    UN                                             E010700886                                       
S,EEU,D,,,,,SAT,LR,10840,VDHW,N47433870,E022533790,,N47433870,E022533790,E0050,00500,2,,506,WGE,SATU MARE,SEEUD        SAT   LR110840VDHW N47433870E022533790    N47433870E022533790E0050005002  506WGESATU MARE                     ,S,Simulation application continuation,SEEUD        SAT   LR2S    UN                                             E006400500                                       
S,EEU,D,,,,,SAU,EY,11520,VDHW,N55524460,E023245900,,N55524460,E023245900,E0100,00500,2,,443,WGE,SIAULIAI,SEEUD        SAU   EY111520VDHW N55524460E023245900    N55524460E023245900E0100005002  443WGESIAULIAI                      ,S,Simulation application continuation,SEEUD        SAU   EY2S    UN                                             E008400500                                       
S,EEU,D,,,,,SBI,LR,11400,VDH,N45465130,E024051610,,N45465130,E024051610,E0050,01500,2,,259,WGE,SIBIU,SEEUD        SBI   LR111400VDH  N45465130E024051610    N45465130E024051610E0050015002  259WGESIBIU                         ,S,Simulation application continuation,SEEUD        SBI   LR2S    UU                                             E0062                                            
S,EEU,D,,,,,SCE,EP,11475,VDH,N53354350,E014525340,,N53354350,E014525340,E0050,00100,2,,386,WGE,SZCZECIN,SEEUD        SCE   EP111475VDH  N53354350E014525340    N53354350E014525340E0050001002  386WGESZCZECIN                      ,S,Simulation application continuation,SEEUD        SCE   EP2S    UN                                             E005600100                                       
S,EEU,D,,,,,SCV,LR,11230,VDHW,N47402040,E026213900,,N47402040,E026213900,E0070,01300,2,,539,WGE,SUCEAVA,SEEUD        SCV   LR111230VDHW N47402040E026213900    N47402040E026213900E0070013002  539WGESUCEAVA                       ,S,Simulation application continuation,SEEUD        SCV   LR2S    UN                                             E007001300                                       
S,EEU,D,,,,,SEM,UA,11530,VDU,N50205870,E080143750,,N50205870,E080143750,E0070,00700,1,,486,WGE,SEMEY,SEEUD        SEM   UA111530VDU  N50205870E080143750    N50205870E080143750E0070007001  486WGESEMEY                         ,S,Simulation application continuation,SEEUD        SEM   UA2S    UN                                             E007100700                                       
S,EEU,D,,,,,SER,ZM,11690,VDHW,N47384110,E106490870,,N47384110,E106490870,W0050,04528,2,,469,WGE,SERGELEN,SEEUD        SER   ZM111690VDHW N47384110E106490870    N47384110E106490870W0050045282  469WGESERGELEN                      ,S,Simulation application continuation,SEEUD        SER   ZM2S    UN                                             W005504528                                       
S,EEU,D,,,,,SEY,ZY,11410,VDHW,N41383000,E123284200,,N41383000,E123284200,W0080,00194,2,,421,WGE,SHENYANG,SEEUD        SEY   ZY111410VDHW N41383000E123284200    N41383000E123284200W0080001942  421WGESHENYANG                      ,S,Simulation application continuation,SEEUD        SEY   ZY2S    UN                                             W009700194                                       
S,EEU,D,,,,,SGM,ZP,11060,VDHW,N25045400,E102311200,,N25045400,E102311200,W0020,07585,2,,,WGE,XISHAN,SEEUD        SGM   ZP111060VDHW N25045400E102311200    N25045400E102311200W0020075852     WGEXISHAN                        ,S,Simulation application continuation,SEEUD        SGM   ZP2S    UY                                             W001707585                                       
S,EEU,D,,,,,SH,US,11330,VDUW,N66351710,E066362850,,N66351710,E066362850,E0230,00200,2,,,WGE,SALEKHARD,SEEUD        SH    US111330VDUW N66351710E066362850    N66351710E066362850E0230002002     WGESALEKHARD                     ,S,Simulation application continuation,SEEUD        SH    US2S    UN                                             E024500200                                       
S,EEU,D,,,,,SHA,ZS,11720,VDLW,N31131878,E121200545,,N31131878,E121200545,W0060,00052,1,,584,WGE,HONGQIAO,SEEUD        SHA   ZS111720VDLW N31131878E121200545    N31131878E121200545W0060000521  584WGEHONGQIAO                      ,S,Simulation application continuation,SEEUD        SHA   ZS2S    UN                                             W006500052                                       
S,EEU,D,,,,,SHC,ZU,11100,VDHW,N29255400,E106434200,,N29255400,E106434200,W0030,01640,2,,,WGE,CHANGSHENGQIAO,SEEUD        SHC   ZU111100VDHW N29255400E106434200    N29255400E106434200W0030016402     WGECHANGSHENGQIAO                ,S,Simulation application continuation,SEEUD        SHC   ZU2S    UN                                             W002901640                                       
S,EEU,D,,,,,SHK,ZG,11590,VDHW,N22294800,E113541200,,N22294800,E113541200,W0020,01112,2,,412,WGE,SHEKOU,SEEUD        SHK   ZG111590VDHW N22294800E113541200    N22294800E113541200W0020011122  412WGESHEKOU                        ,S,Simulation application continuation,SEEUD        SHK   ZG2S    UN                                             W003301112                                       
S,EEU,D,,,,,SHL,ZG,11570,VDHW,N23053000,E113510000,,N23053000,E113510000,W0030,00500,2,,,WGE,SHILONG,SEEUD        SHL   ZG111570VDHW N23053000E113510000    N23053000E113510000W0030005002     WGESHILONG                       ,S,Simulation application continuation,SEEUD        SHL   ZG2S    UN                                             W003400500                                       
S,EEU,D,,,,,SHR,ZS,11400,VDHW,N28250000,E117581200,,N28250000,E117581200,W0040,00001,2,,275,WGE,SHANGRAO,SEEUD        SHR   ZS111400VDHW N28250000E117581200    N28250000E117581200W0040000012  275WGESHANGRAO                      ,S,Simulation application continuation,SEEUD        SHR   ZS2S    UN                                             W0052                                            
S,EEU,D,,,,,SHX,ZL,11250,VDHW,N33523600,E109560600,,N33523600,E109560600,W0040,02480,2,,581,WGE,SHANGXIAN,SEEUD        SHX   ZL111250VDHW N33523600E109560600    N33523600E109560600W0040024802  581WGESHANGXIAN                     ,S,Simulation application continuation,SEEUD        SHX   ZL2S    UN                                             W004402480                                       
S,EEU,D,,,,,SHZ,ZS,11340,VDUW,N29360000,E120490000,,N29360000,E120490000,W0060,00250,2,,596,WGE,SHENGZHOU,SEEUD        SHZ   ZS111340VDUW N29360000E120490000    N29360000E120490000W0060002502  596WGESHENGZHOU                     ,S,Simulation application continuation,SEEUD        SHZ   ZS2S    UY                                             W006000250                                       
S,EEU,D,,,,,SIE,EP,11470,VDHW,N52091900,E022120300,,N52091900,E022120300,E0050,00600,2,,413,WGE,SIEDLCE,SEEUD        SIE   EP111470VDHW N52091900E022120300    N52091900E022120300E0050006002  413WGESIEDLCE                       ,S,Simulation application continuation,SEEUD        SIE   EP2S    UN                                             E007200600                                       
S,EEU,D,,,,,SJD,ZS,11310,VDHW,N32323866,E119433024,,N32323866,E119433024,W0060,00043,2,,468,WGE,YANGZHOU,SEEUD        SJD   ZS111310VDHW N32323866E119433024    N32323866E119433024W0060000432  468WGEYANGZHOU                      ,S,Simulation application continuation,SEEUD        SJD   ZS2S    UN                                             W006500043                                       
S,EEU,D,,,,,SJG,ZG,11680,VDHW,N25463600,E109363600,,N25463600,E109363600,W0020,01122,2,,542,WGE,SANJIANG,SEEUD        SJG   ZG111680VDHW N25463600E109363600    N25463600E109363600W0020011222  542WGESANJIANG                      ,S,Simulation application continuation,SEEUD        SJG   ZG2S    UN                                             W0030                                            
S,EEU,D,,,,,SJW,ZB,11770,VDHW,N38164800,E114415400,,N38164800,E114415400,W0060,00223,2,,550,WGE,ZHENGDING,SEEUD        SJW   ZB111770VDHW N38164800E114415400    N38164800E114415400W0060002232  550WGEZHENGDING                     ,S,Simulation application continuation,SEEUD        SJW   ZB2S    UN                                             W006600223                                       
S,EEU,D,,,,,SKD,UT,11500,VDHW,N39421345,E066582158,,N39421345,E066582158,E0050,02200,2,,,WGE,SAMARKAND,SEEUD        SKD   UT111500VDHW N39421345E066582158    N39421345E066582158E0050022002     WGESAMARKAND                     ,S,Simulation application continuation,SEEUD        SKD   UT2S    UN                                             E005302200                                       
S,EEU,D,,,,,SLC,LZ,11400,VDH,N48271170,E019065710,,N48271170,E019065710,E0050,01662,2,,259,WGE,SLIAC,SEEUD        SLC   LZ111400VDH  N48271170E019065710    N48271170E019065710E0050016622  259WGESLIAC                         ,S,Simulation application continuation,SEEUD        SLC   LZ2S    UN                                             E005801662                                       
S,EEU,D,,,,,SLV,UK,11330,VDHW,N50111250,E029341250,,N50111250,E029341250,E0070,00671,2,,325,WGE,SOLOVIIVKA,SEEUD        SLV   UK111330VDHW N50111250E029341250    N50111250E029341250E0070006712  325WGESOLOVIIVKA                    ,S,Simulation application continuation,SEEUD        SLV   UK2S    UN                                             E0082                                            
S,EEU,D,,,,,SMK,UA,11300,VDHW,N42222040,E069263060,,N42222040,E069263060,E0060,01400,2,,487,WGE,SHYMKENT,SEEUD        SMK   UA111300VDHW N42222040E069263060    N42222040E069263060E0060014002  487WGESHYMKENT                      ,S,Simulation application continuation,SEEUD        SMK   UA2S    UN                                             E006101400                                       
S,EEU,D,,,,,SND,ZM,11660,VDHW,N44541100,E110074900,,N44541100,E110074900,W0060,03445,2,,,WGE,SAINSHAND,SEEUD        SND   ZM111660VDHW N44541100E110074900    N44541100E110074900W0060034452     WGESAINSHAND                     ,S,Simulation application continuation,SEEUD        SND   ZM2S    UY                                             W006403445                                       
S,EEU,D,,,,,SNF,ZH,11215,VDHW,N31043000,E109424200,,N31043000,E109424200,W0040,05837,2,,,WGE,WUSHAN,SEEUD        SNF   ZH111215VDHW N31043000E109424200    N31043000E109424200W0040058372     WGEWUSHAN                        ,S,Simulation application continuation,SEEUD        SNF   ZH2S    UY                                             W003905837                                       
S,EEU,D,,,,,SNQ,ZS,11575,VDHW,N31404800,E118580600,,N31404800,E118580600,W0060,00089,2,,,WGE,SHIQIU,SEEUD        SNQ   ZS111575VDHW N31404800E118580600    N31404800E118580600W0060000892     WGESHIQIU                        ,S,Simulation application continuation,SEEUD        SNQ   ZS2S    UN                                             W006200089                                       
S,EEU,D,,,,,SOF,LB,11260,VDH,N42415320,E023232180,,N42415320,E023232180,E0050,01800,2,,329,WGE,SOFIA,SEEUD        SOF   LB111260VDH  N42415320E023232180    N42415320E023232180E0050018002  329WGESOFIA                         ,S,Simulation application continuation,SEEUD        SOF   LB2S    UU                                             E0057                                            
S,EEU,D,,,,,SPB,UL,11340,VDHW,N59482480,E030162870,,N59482510,E030162900,E0110,00100,2,,386,WGE,ST PETERSBURG,SEEUD        SPB   UL111340VDHW N59482480E030162870    N59482510E030162900E0110001002  386WGEST PETERSBURG                 ,S,Simulation application continuation,SEEUD        SPB   UL2S    UN                                             E012000100                                       
S,EEU,D,,,,,SQH,ZU,11450,VDHW,N32273000,E080033600,,N32273000,E080033600,E0010,14085,2,,600,WGE,SHIQUANHE,SEEUD        SQH   ZU111450VDHW N32273000E080033600    N32273000E080033600E0010140852  600WGESHIQUANHE                     ,S,Simulation application continuation,SEEUD        SQH   ZU2S    UY                                             E001814085                                       
S,EEU,D,,,,,SRN,UW,10840,VDHW,N54074780,E045125180,,N54074810,E045125140,E0120,00700,2,,222,WGE,SARANSK,SEEUD        SRN   UW110840VDHW N54074780E045125180    N54074810E045125140E0120007002  222WGESARANSK                       ,S,Simulation application continuation,SEEUD        SRN   UW2S    UN                                             E012500700                                       
S,EEU,D,,,,,STJ,LR,11320,VDHW,N44550680,E025583730,,N44550680,E025583730,E0050,00600,2,,321,WGE,STREJNIC,SEEUD        STJ   LR111320VDHW N44550680E025583730    N44550680E025583730E0050006002  321WGESTREJNIC                      ,S,Simulation application continuation,SEEUD        STJ   LR2S    UN                                             E006400600                                       
S,EEU,D,,,,,STR,UW,11290,VDHW,N56132350,E043463670,,N56132360,E043463600,E0130,00300,2,,576,WGE,STRIGINO (NIZHNY NOVGOROD),SEEUD        STR   UW111290VDHW N56132350E043463670    N56132360E043463600E0130003002  576WGESTRIGINO (NIZHNY NOVGOROD)    ,S,Simulation application continuation,SEEUD        STR   UW2S    UN                                             E013500300                                       
S,EEU,D,,,,,STW,UR,11490,VDHW,N45062890,E042070070,,N45062890,E042070070,E0080,01500,2,,267,WGE,SHPAKOVSKOYE,SEEUD        STW   UR111490VDHW N45062890E042070070    N45062890E042070070E0080015002  267WGESHPAKOVSKOYE                  ,S,Simulation application continuation,SEEUD        STW   UR2S    UN                                             E008101500                                       
S,EEU,D,,,,,SUF,ZS,11410,VDLW,N31295400,E120255400,,N31295400,E120255400,W0050,00036,1,,386,WGE,SHUOFANG,SEEUD        SUF   ZS111410VDLW N31295400E120255400    N31295400E120255400W0050000361  386WGESHUOFANG                      ,S,Simulation application continuation,SEEUD        SUF   ZS2S    UY                                             W006400036                                       
