record_type,area_code,sec,subsection_code,airport_icao,icao_code,sub,vor_ident,navaid_icao_code,vor_frequency,navaid_class,vor_latitude,vor_longitude,dme_ident,dme_latitude,dme_longitude,station_declination,dme_elevation,figure_of_merit,ils_dme_bias,frequency_protection,datum_code,vor_name,primary_1_123,cont#2_appl_code,cont#2_appl_label,cont#2_1_123
S,EEU,D,,,,,CHW,ZL,11450,VDHW,N39511800,E098210000,,N39511800,E098210000,W0010,05115,2,,,WGE,JIAYUGUAN,SEEUD        CHW   ZL111450VDHW N39511800E098210000    N39511800E098210000W0010051152     WGEJIAYUGUAN                     ,S,Simulation application continuation,SEEUD        CHW   ZL2S    UN                                             W001405115                                       
S,EEU,D,,,,,GMM,ZU,11250,VDHW,N29254800,E094271800,,N29254800,E094271800,W0000,09604,2,,518,WGE,GAMA,SEEUD        GMM   ZU111250VDHW N29254800E094271800    N29254800E094271800W0000096042  518WGEGAMA                          ,S,Simulation application continuation,SEEUD        GMM   ZU2S    UN                                             W000609604                                       
S,EEU,D,,,,,GRU,EP,11460,VDHW,N53311600,E018465300,,N53311600,E018465300,E0040,00300,2,,331,WGE,GRUDZIADZ,SEEUD        GRU   EP111460VDHW N53311600E018465300    N53311600E018465300E0040003002  331WGEGRUDZIADZ                     ,S,Simulation application continuation,SEEUD        GRU   EP2S    UN                                             E006600300                                       
S,EEU,D,,,,,IOD,LR,10950,DT,,,IOD,N47014930,E021541990,,00500,0,,101,WGE,ORADEA,SEEUD        IOD   LR110950 DT                     IOD N47014930E021541990     005000  101WGEORADEA                        ,S,Simulation application continuation,SEEUD        IOD   LR2S    UN                                             E0061                                            
S,EEU,D,,,,,MZL,ZY,11310,VDHW,N49194200,E117384200,,N49194200,E117384200,W0100,02231,2,,273,WGE,MANZHOULI,SEEUD        MZL   ZY111310VDHW N49194200E117384200    N49194200E117384200W0100022312  273WGEMANZHOULI                     ,S,Simulation application continuation,SEEUD        MZL   ZY2S    UN                                             W010302231                                       
S,EEU,D,,,,,QIY,ZL,11340,VDHW,N35474800,E107355400,,N35474800,E107355400,W0030,04629,2,,513,WGE,QINGYANG,SEEUD        QIY   ZL111340VDHW N35474800E107355400    N35474800E107355400W0030046292  513WGEQINGYANG                      ,S,Simulation application continuation,SEEUD        QIY   ZL2S    UN                                             W004004629                                       
S,EEU,D,,,,,SL,US,11150,DH,,,SL,N53533600,E051110500,,00394,2,,492,WGE,SUKHODOL,SEEUD        SL    US111150 DH                     SL  N53533600E051110500     003942  492WGESUKHODOL                      ,S,Simulation application continuation,SEEUD        SL    US2S    UN                                             E0130                                            
S,EEU,D,,,,,URG,UT,11420,VDUW,N41344410,E060391790,,N41344410,E060391790,E0060,00322,2,,417,WGE,URGENCH,SEEUD        URG   UT111420VDUW N41344410E060391790    N41344410E060391790E0060003222  417WGEURGENCH                       ,S,Simulation application continuation,SEEUD        URG   UT2S    UN                                             E006500322                                       
S,EEU,D,,,,,WDT,UH,10820,DH,,,WDT,N43243070,E132103000,,00059,2,,453,WGE,KNEVICHI (VLADIVOSTOK),SEEUD        WDT   UH110820 DH                     WDT N43243070E132103000     000592  453WGEKNEVICHI (VLADIVOSTOK)        ,S,Simulation application continuation,SEEUD        WDT   UH2S    UN                                             W0109                                            
S,EEU,D,,,,,ZAO,VM,11720,VDHW,N22144200,E113364200,,N22144200,E113364200,W0030,00155,2,,,WGE,JIUZHOU,SEEUD        ZAO   VM111720VDHW N22144200E113364200    N22144200E113364200W0030001552     WGEJIUZHOU                       ,S,Simulation application continuation,SEEUD        ZAO   VM2S    UN                                             W003200155                                       
S,EEU,D,,URKG,UR,,IGN,UR,11010,ITDN,,,IGN,N44341630,E038002750,,00131,0,02,208,WGE,GELENDZHIK,SEEUD URKGUR IGN   UR111010 ITDN                   IGN N44341630E038002750     00131002208WGEGELENDZHIK                    ,S,Simulation application continuation,SEEUD URKGUR IGN   UR2S    UN                                             E007600131                                       
S,EEU,D,,UTSA,UT,,IHG,UT,10930,ITDN,,,IHG,N40064592,E065090875,,01200,0,02,,WGE,NAVOI,SEEUD UTSAUT IHG   UT110930 ITDN                   IHG N40064592E065090875     01200002   WGENAVOI                         ,S,Simulation application continuation,SEEUD UTSAUT IHG   UT2S    UN                                             E005601200                                       
S,EEU,D,,UTSA,UT,,INL,UT,10870,ITDN,,,INL,N40071046,E065112721,,01200,0,02,342,WGE,NAVOI,SEEUD UTSAUT INL   UT110870 ITDN                   INL N40071046E065112721     01200002342WGENAVOI                         ,S,Simulation application continuation,SEEUD UTSAUT INL   UT2S    UN                                             E005601200                                       
S,EEU,D,,UTSS,UT,,IMZ,UT,10950,ITDN,,,IMZ,N39421393,E066580413,,02200,0,02,,WGE,SAMARKAND,SEEUD UTSSUT IMZ   UT110950 ITDN                   IMZ N39421393E066580413     02200002   WGESAMARKAND                     ,S,Simulation application continuation,SEEUD UTSSUT IMZ   UT2S    UN                                             E005302200                                       
S,EEU,D,,UTSS,UT,,ISD,UT,11070,ITDN,,,ISD,N39420626,E066594350,,02200,0,02,227,WGE,SAMARKAND,SEEUD UTSSUT ISD   UT111070 ITDN                   ISD N39420626E066594350     02200002227WGESAMARKAND                     ,S,Simulation application continuation,SEEUD UTSSUT ISD   UT2S    UN                                             E005302200                                       
S,EEU,D,,UTST,UT,,INO,UT,11030,ITDN,,,INO,N37172923,E067191415,,01100,0,02,104,WGE,TERMEZ INTL,SEEUD UTSTUT INO   UT111030 ITDN                   INO N37172923E067191415     01100002104WGETERMEZ INTL                   ,S,Simulation application continuation,SEEUD UTSTUT INO   UT2S    UN                                             E004401100                                       
S,EEU,D,,UTTT,UT,,IFD,UT,10850,ITDN,,,IFD,N41153260,E069174590,,01414,0,02,542,WGE,ISLAM KARIMOV,SEEUD UTTTUT IFD   UT110850 ITDN                   IFD N41153260E069174590     01414002542WGEISLAM KARIMOV                 ,S,Simulation application continuation,SEEUD UTTTUT IFD   UT2S    UN                                             E005601414                                       
S,EEU,D,,UTTT,UT,,ING,UT,11050,ITDN,,,ING,N41151980,E069155090,,01387,0,02,296,WGE,ISLAM KARIMOV,SEEUD UTTTUT ING   UT111050 ITDN                   ING N41151980E069155090     01387002296WGEISLAM KARIMOV                 ,S,Simulation application continuation,SEEUD UTTTUT ING   UT2S    UN                                             E005601387                                       
S,EEU,D,,UTTT,UT,,IZW,UT,11170,ITDN,,,IZW,N41151320,E069155080,,01385,0,02,067,WGE,ISLAM KARIMOV,SEEUD UTTTUT IZW   UT111170 ITDN                   IZW N41151320E069155080     01385002067WGEISLAM KARIMOV                 ,S,Simulation application continuation,SEEUD UTTTUT IZW   UT2S    UN                                             E005601385                                       
S,EEU,D,,ZWWW,ZW,,IOY,ZW,10970,IT N,,,IOY,N43541585,E087272231,,02139,0,,419,WGE,DIWOPU,SEEUD ZWWWZW IOY   ZW110970 IT N                   IOY N43541585E087272231     021390  419WGEDIWOPU                        ,S,Simulation application continuation,SEEUD ZWWWZW IOY   ZW2S    UN                                             E002602139                                       
S,EEU,D,,ZWWW,ZW,,IRM,ZW,11030,IT N,,,IRM,N43544268,E087292819,,02139,0,,456,WGE,DIWOPU,SEEUD ZWWWZW IRM   ZW111030 IT N                   IRM N43544268E087292819     021390  456WGEDIWOPU                        ,S,Simulation application continuation,SEEUD ZWWWZW IRM   ZW2S    UN                                             E002602139                                       
S,EEU,D,B,,,,AN,UT,04220,H MW,N40413650,E072145080,,,,E0050,,,,,WGE,ANDIZHAN,SEEUDB       AN    UT104220H MW N40413650E072145080                       E0050           WGEANDIZHAN                      ,S,Simulation application continuation,SEEUDB       AN    UT2S     U24                                                                                            
S,EEU,D,B,,,,AVN,EY,03850,H L,N54405380,E025190730,,,,E0080,,,,,WGE,VILNIUS,SEEUDB       AVN   EY103850H L  N54405380E025190730                       E0080           WGEVILNIUS                       ,S,Simulation application continuation,SEEUDB       AVN   EY2S     U24                                                                                            
S,EEU,D,B,,,,N,LK,02580,H L,N49424752,E018081691,,,,E0060,,,,,WGE,NADA (OSTRAVA),SEEUDB       N     LK102580H L  N49424752E018081691                       E0060           WGENADA (OSTRAVA)                ,S,Simulation application continuation,SEEUDB       N     LK2S     U24                                                00844                                       
S,EEU,D,B,,,,OS,ZU,02410,H HW,N29510600,E106504800,,,,W0030,,,,,WGE,TONGJINGCHANG,SEEUDB       OS    ZU102410H HW N29510600E106504800                       W0030           WGETONGJINGCHANG                 ,S,Simulation application continuation,SEEUDB       OS    ZU2S     U21                                                                                            
S,EEU,D,B,,,,R,LK,05340,H L,N49404564,E018050264,,,,E0060,,,,,WGE,RADA (OSTRAVA),SEEUDB       R     LK105340H L  N49404564E018050264                       E0060           WGERADA (OSTRAVA)                ,S,Simulation application continuation,SEEUDB       R     LK2S     U24                                                00844                                       
S,EEU,D,B,,,,UC,ZB,03510,H MW,N49130600,E119574200,,,,W0110,,,,,WGE,XIHA,SEEUDB       UC    ZB103510H MW N49130600E119574200                       W0110           WGEXIHA                          ,S,Simulation application continuation,SEEUDB       UC    ZB2S     U14                                                                                            
S,EUR,D,,,,,AN,LF,11050,DT,,,AN,N43544140,E004540800,,00168,0,,235,WGE,AVIGNON CAUMONT,SEURD        AN    LF111050 DT                     AN  N43544140E004540800     001680  235WGEAVIGNON CAUMONT               ,S,Simulation application continuation,SEURD        AN    LF2S    UU                                             E0025                                            
S,EUR,D,,,,,CGS,LF,10920,DT,,,CGS,N43384290,E007084530,,00036,0,,329,WGE,CAGNES-SUR-MER,SEURD        CGS   LF110920 DT                     CGS N43384290E007084530     000360  329WGECAGNES-SUR-MER                ,S,Simulation application continuation,SEURD        CGS   LF2S    UU                                             E0030                                            
S,EUR,D,,,,,DID,ED,11790,DL,,,DID,N51170122,E006451648,,00126,1,,250,WGE,DUESSELDORF INTERIM,SEURD        DID   ED111790 DL                     DID N51170122E006451648     001261  250WGEDUESSELDORF INTERIM           ,S,Simulation application continuation,SEURD        DID   ED2S    UN                                             E0031                                            
S,EUR,D,,,,,GSY,EB,11570,VDHA,N50271410,E004262900,,N50271410,E004262900,E0010,00600,2,,275,WGE,GOSLY (CHARLEROI),SEURD        GSY   EB111570VDHA N50271410E004262900    N50271410E004262900E0010006002  275WGEGOSLY (CHARLEROI)             ,S,Simulation application continuation,SEURD        GSY   EB2S    UN                                             E0024                                            
S,EUR,D,,,,,LNE,EF,11230,VDH,N62251483,E025372403,,N62251483,E025372403,E0100,00696,2,,337,WGE,LUONET (JYVASKYLA),SEURD        LNE   EF111230VDH  N62251483E025372403    N62251483E025372403E0100006962  337WGELUONET (JYVASKYLA)            ,S,Simulation application continuation,SEURD        LNE   EF2S    UN                                             E011300696                                       
S,EUR,D,,,,,MTR,ED,11000,V HW,N50163459,E008505505,,,,E0020,,2,,,WGE,METRO,SEURD        MTR   ED111000V HW N50163459E008505505                       E0020     2     WGEMETRO                         ,S,Simulation application continuation,SEURD        MTR   ED2S    UN                                             E003600633                                       
S,EUR,D,,,,,ROI,EF,11770,VDH,N66334514,E025491347,,N66334514,E025491347,E0130,00661,2,,584,WGE,ROVANI (ROVANIEMI),SEURD        ROI   EF111770VDH  N66334514E025491347    N66334514E025491347E0130006612  584WGEROVANI (ROVANIEMI)            ,S,Simulation application continuation,SEURD        ROI   EF2S    UN                                             E013200661                                       
S,EUR,D,,EGCN,EG,,IFIN,EG,11095,ITDN,,,IFIN,N53282954,W001000714,,00049,0,07,111,WGE,DONCASTER SHEFFIELD,SEURD EGCNEG IFIN  EG111095 ITDN                   IFINN53282954W001000714     00049007111WGEDONCASTER SHEFFIELD           ,S,Simulation application continuation,SEURD EGCNEG IFIN  EG2S    UN                                             E000500049                                       
S,EUR,D,,EGCN,EG,,IFNL,EG,11095,ITDN,,,IFNL,N53282954,W001000714,,00049,0,07,111,WGE,DONCASTER SHEFFIELD,SEURD EGCNEG IFNL  EG111095 ITDN                   IFNLN53282954W001000714     00049007111WGEDONCASTER SHEFFIELD           ,S,Simulation application continuation,SEURD EGCNEG IFNL  EG2S    UN                                             E000500049                                       
S,EUR,D,,LFAQ,LF,,ABY,LF,10875,IT N,,,ABY,N49581850,E002421780,,00403,0,,112,WGE,BRAY,SEURD LFAQLF ABY   LF110875 IT N                   ABY N49581850E002421780     004030  112WGEBRAY                          ,S,Simulation application continuation,SEURD LFAQLF ABY   LF2S    UU                                             E001900403                                       
S,EUR,D,B,,,,AGO,LF,04040,H L,N45423860,E000253680,,,,E0010,,,,,WGE,ANGOULEME,SEURDB       AGO   LF104040H L  N45423860E000253680                       E0010           WGEANGOULEME                     ,S,Simulation application continuation,SEURDB       AGO   LF2S     U24                                                00456                                       
S,EUR,D,B,,,,BLC,LY,03770,H,N43144820,E021214380,,,,E0050,,,,,WGE,BLACE,SEURDB       BLC   LY103770H    N43144820E021214380                       E0050           WGEBLACE                         ,S,Simulation application continuation,SEURDB       BLC   LY2S     N21                                                                                            
S,EUR,D,B,,,,BRG,LF,03750,H MW,N47010430,E002165360,,,,E0010,,,,,WGE,BOURGES,SEURDB       BRG   LF103750H MW N47010430E002165360                       E0010           WGEBOURGES                       ,S,Simulation application continuation,SEURDB       BRG   LF2S     U24                                                                                            
S,EUR,D,B,,,,EJ,EK,04005,H LW,N55322851,E008415911,,,,E0030,,,,,WGE,ESBJERG,SEURDB       EJ    EK104005H LW N55322851E008415911                       E0030           WGEESBJERG                       ,S,Simulation application continuation,SEURDB       EJ    EK2S     U24                                                                                            
S,EUR,D,B,,,,FNY,EG,03380,H L,N53282936,W001000622,,,,E0000,,,,,WGE,DONCASTER SHEFFIELD,SEURDB       FNY   EG103380H L  N53282936W001000622                       E0000           WGEDONCASTER SHEFFIELD           ,S,Simulation application continuation,SEURDB       FNY   EG2S     N24                                                                                            
S,EUR,D,B,,,,GA,BI,03770,H M,N65524020,W017274780,,,,W0110,,,,,WGE,GARDUR (HUSAVIK),SEURDB       GA    BI103770H M  N65524020W017274780                       W0110           WGEGARDUR (HUSAVIK)              ,S,Simulation application continuation,SEURDB       GA    BI2S     N24                                                                                            
S,EUR,D,B,,,,HA,BI,03480,H L,N65374650,W015022920,,,,W0090,,,,,WGE,HOFSA,SEURDB       HA    BI103480H L  N65374650W015022920                       W0090           WGEHOFSA                         ,S,Simulation application continuation,SEURDB       HA    BI2S     N21                                                                                            
S,EUR,D,B,,,,HP,EK,03760,H MW,N55304117,E008244579,,,,E0030,,,,,WGE,ESBJERG,SEURDB       HP    EK103760H MW N55304117E008244579                       E0030           WGEESBJERG                       ,S,Simulation application continuation,SEURDB       HP    EK2S     U21                                                                                            
S,EUR,D,B,,,,KIT,EF,03280,H L,N67372306,E024535088,,,,E0120,,,,,WGE,KITTILA,SEURDB       KIT   EF103280H L  N67372306E024535088                       E0120           WGEKITTILA                       ,S,Simulation application continuation,SEURDB       KIT   EF2S     N24                                                00644                                       
S,EUR,D,B,,,,KN,LY,03800,H,N44534070,E020081010,,,,E0050,,,,,WGE,BELGRADE,SEURDB       KN    LY103800H    N44534070E020081010                       E0050           WGEBELGRADE                      ,S,Simulation application continuation,SEURDB       KN    LY2S     N24                                                                                            
S,EUR,D,B,,,,L,EF,03440,H L,N67431640,E024500132,,,,E0120,,,,,WGE,LIMA (KITTILA),SEURDB       L     EF103440H L  N67431640E024500132                       E0120           WGELIMA (KITTILA)                ,S,Simulation application continuation,SEURDB       L     EF2S     N24                                                00632                                       
S,EUR,D,B,,,,LI,ED,04170,H LW,N51204916,E006532862,,,,E0030,,,,,WGE,DUESSELDORF,SEURDB       LI    ED104170H LW N51204916E006532862                       E0030           WGEDUESSELDORF                   ,S,Simulation application continuation,SEURDB       LI    ED2S     U24                                                                                            
S,EUR,D,B,,,,LOE,LF,04240,H LW,N46014890,E001202190,,,,E0010,,,,,WGE,LIMOGES,SEURDB       LOE   LF104240H LW N46014890E001202190                       E0010           WGELIMOGES                       ,S,Simulation application continuation,SEURDB       LOE   LF2S     U24                                                                                            
S,EUR,D,B,,,,LYE,ED,03940,H MW,N53480299,E010414513,,,,E0030,,,,,WGE,LUEBECK,SEURDB       LYE   ED103940H MW N53480299E010414513                       E0030           WGELUEBECK                       ,S,Simulation application continuation,SEURDB       LYE   ED2S     U21                                                                                            
S,EUR,D,B,,,,TLB,LF,03680,H LW,N43564700,E001262900,,,,E0010,,,,,WGE,TOULOUSE,SEURDB       TLB   LF103680H LW N43564700E001262900                       E0010           WGETOULOUSE                      ,S,Simulation application continuation,SEURDB       TLB   LF2S     U21                                                00499                                       
S,EUR,D,B,,,,VRS,LD,03690,H  W,N45123666,E013385631,,,,E0040,,,,,WGE,VRSAR,SEURDB       VRS   LD103690H  W N45123666E013385631                       E0040           WGEVRSAR                         ,S,Simulation application continuation,SEURDB       VRS   LD2S     U21                                                                                            
S,EUR,D,B,,,,WCO,EG,03350,H M,N51511051,W000574467,,,,E0000,,,,,WGE,WESTCOTT,SEURDB       WCO   EG103350H M  N51511051W000574467                       E0000           WGEWESTCOTT                      ,S,Simulation application continuation,SEURDB       WCO   EG2S     N24                                                                                            
S,MES,D,,,,,KMC,OE,11590,VTHW,N27525010,E045332050,,N27525010,E045332050,E0040,01400,2,,583,WGE,KING SAUD AB (HAFR AL BATIN),SMESD        KMC   OE111590VTHW N27525010E045332050    N27525010E045332050E0040014002  583WGEKING SAUD AB (HAFR AL BATIN)  ,S,Simulation application continuation,SMESD        KMC   OE2S    UN                                             E0037                                            
S,MES,D,,,,,LOT,LL,11200,DU,,,LOT,N31473480,E035022940,,00668,3,,428,WGE,BET-MEIR,SMESD        LOT   LL111200 DU                     LOT N31473480E035022940     006683  428WGEBET-MEIR                      ,S,Simulation application continuation,SMESD        LOT   LL2S    UN                                             E0049                                            
S,MES,D,,OEKK,OE,,IKMC,OE,10870,IT N,,,IKMC,N27532840,E045322120,,01341,0,,361,WGE,KING SAUD AB,SMESD OEKKOE IKMC  OE110870 IT N                   IKMCN27532840E045322120     013410  361WGEKING SAUD AB                  ,S,Simulation application continuation,SMESD OEKKOE IKMC  OE2S    UN                                             E003701341                                       
S,MES,D,B,,,,AH,VA,02150,H MW,N23082900,E072415880,,,,W0000,,,,,WGE,AHMEDABAD,SMESDB       AH    VA102150H MW N23082900E072415880                       W0000           WGEAHMEDABAD                     ,S,Simulation application continuation,SMESDB       AH    VA2S     U24                                                                                            
S,MES,D,B,,,,BY,VI,02180,H  W,N28242700,E079271800,,,,E0000,,,,,WGE,BAREILLY,SMESDB       BY    VI102180H  W N28242700E079271800                       E0000           WGEBAREILLY                      ,S,Simulation application continuation,SMESDB       BY    VI2S     U24                                                                                            
S,MES,D,B,,,,CB,VG,03960,H  W,N21271030,E091575670,,,,W0010,,,,,WGE,COX'S BAZAR,SMESDB       CB    VG103960H  W N21271030E091575670                       W0010           WGECOX'S BAZAR                   ,S,Simulation application continuation,SMESDB       CB    VG2S     U21                                                                                            
S,MES,D,B,,,,CP,VO,02630,H  W,N14305630,E078461680,,,,W0020,,,,,WGE,KADAPA,SMESDB       CP    VO102630H  W N14305630E078461680                       W0020           WGEKADAPA                        ,S,Simulation application continuation,SMESDB       CP    VO2S     U21                                                                                            
S,MES,D,B,,,,GEY,LT,04130,H MW,N36521910,E030271940,,,,E0040,,,,,WGE,GEYIKBAYIRI (ANTALYA),SMESDB       GEY   LT104130H MW N36521910E030271940                       E0040           WGEGEYIKBAYIRI (ANTALYA)         ,S,Simulation application continuation,SMESDB       GEY   LT2S     U24                                                                                            
S,MES,D,B,,,,IS,VG,03500,H  W,N24091030,E089024140,,,,W0000,,,,,WGE,ISHURDI,SMESDB       IS    VG103500H  W N24091030E089024140                       W0000           WGEISHURDI                       ,S,Simulation application continuation,SMESDB       IS    VG2S     U21                                                                                            
