S,EEU,D,,URMO,UR,,ICH,UR,11050,IT N,,,ICH,N43123000,E044353380,,01772,0,,156,WGE,BESLAN,S,Simulation application continuation,UN,E0075,01772,73553,2113,SEEUD URMOUR ICH   UR111050 IT N                   ICH N43123000E044353380     017720  156WGEBESLAN                        ,SEEUD URMOUR ICH   UR2S    UN                                             E007501772                                       
S,EEU,D,,URMO,UR,,IWL,UR,11130,IT N,,,IWL,N43121500,E044371470,,01772,0,,166,WGE,BESLAN,S,Simulation application continuation,UN,E0075,01772,73555,2113,SEEUD URMOUR IWL   UR111130 IT N                   IWL N43121500E044371470     017720  166WGEBESLAN                        ,SEEUD URMOUR IWL   UR2S    UN                                             E007501772                                       
S,EEU,D,,URMS,UR,,ISC,UR,10890,IT N,,,ISC,N43192330,E044595710,,01200,0,,100,WGE,MAGAS,S,Simulation application continuation,UN,E0075,01200,73557,2308,SEEUD URMSUR ISC   UR110890 IT N                   ISC N43192330E044595710     012000  100WGEMAGAS                         ,SEEUD URMSUR ISC   UR2S    UN                                             E007501200                                       
S,EEU,D,,URMT,UR,,IKT,UR,11070,IT N,,,IKT,N45063580,E042073240,,01500,0,,125,WGE,SHPAKOVSKOYE,S,Simulation application continuation,UN,E0081,01500,73559,2101,SEEUD URMTUR IKT   UR111070 IT N                   IKT N45063580E042073240     015000  125WGESHPAKOVSKOYE                  ,SEEUD URMTUR IKT   UR2S    UN                                             E008101500                                       
S,EEU,D,,URMT,UR,,IOP,UR,11050,IT N,,,IOP,N45062000,E042060490,,01500,0,,136,WGE,SHPAKOVSKOYE,S,Simulation application continuation,UN,E0081,01500,73561,2101,SEEUD URMTUR IOP   UR111050 IT N                   IOP N45062000E042060490     015000  136WGESHPAKOVSKOYE                  ,SEEUD URMTUR IOP   UR2S    UN                                             E008101500                                       
S,EEU,D,,URRP,UR,,IRD,UR,11150,ITDN,,,IRD,N47291270,E039542670,,00200,0,02,187,WGE,PLATOV,S,Simulation application continuation,UN,E0087,00200,73563,2112,SEEUD URRPUR IRD   UR111150 ITDN                   IRD N47291270E039542670     00200002187WGEPLATOV                        ,SEEUD URRPUR IRD   UR2S    UN                                             E008700200                                       
S,EEU,D,,URRP,UR,,IRS,UR,11090,ITDN,,,IRS,N47300810,E039562090,,00300,0,02,184,WGE,PLATOV,S,Simulation application continuation,UN,E0088,00300,73565,2112,SEEUD URRPUR IRS   UR111090 ITDN                   IRS N47300810E039562090     00300002184WGEPLATOV                        ,SEEUD URRPUR IRS   UR2S    UN                                             E008800300                                       
S,EEU,D,,URSS,UR,,IAD,UR,11050,ITDN,,,IAD,N43261030,E039565160,,00115,0,02,136,WGE,SOCHI,S,Simulation application continuation,UN,E0074,00115,73567,2413,SEEUD URSSUR IAD   UR111050 ITDN                   IAD N43261030E039565160     00115002136WGESOCHI                         ,SEEUD URSSUR IAD   UR2S    UN                                             E007400115                                       
S,EEU,D,,URSS,UR,,ISO,UR,11110,ITDN,,,ISO,N43262280,E039554850,,00092,0,02,357,WGE,SOCHI,S,Simulation application continuation,UN,E0074,00092,73569,2413,SEEUD URSSUR ISO   UR111110 ITDN                   ISO N43262280E039554850     00092002357WGESOCHI                         ,SEEUD URSSUR ISO   UR2S    UN                                             E007400092                                       
S,EEU,D,,URWA,UR,,IBJ,UR,11050,ITDN,,,IBJ,N46165720,E048014040,,-0050,0,02,211,WGE,ASTRAKHAN,S,Simulation application continuation,UN,E0088,-0050,73571,2403,SEEUD URWAUR IBJ   UR111050 ITDN                   IBJ N46165720E048014040     -0050002211WGEASTRAKHAN                     ,SEEUD URWAUR IBJ   UR2S    UN                                             E0088-0050                                       
S,EEU,D,,URWA,UR,,IGV,UR,11030,ITDN,,,IGV,N46170720,E047593880,,-0060,0,02,306,WGE,ASTRAKHAN,S,Simulation application continuation,UN,E0088,-0060,73573,2403,SEEUD URWAUR IGV   UR111030 ITDN                   IGV N46170720E047593880     -0060002306WGEASTRAKHAN                     ,SEEUD URWAUR IGV   UR2S    UN                                             E0088-0060                                       
S,EEU,D,,URWI,UR,,ISA,UR,10850,ITDN,,,ISA,N46222950,E044182520,,00492,0,02,472,WGE,ELISTA,S,Simulation application continuation,UN,E0087,00492,73575,2013,SEEUD URWIUR ISA   UR110850 ITDN                   ISA N46222950E044182520     00492002472WGEELISTA                        ,SEEUD URWIUR ISA   UR2S    UN                                             E008700492                                       
S,EEU,D,,URWW,UR,,IWD,UR,11050,IT N,,,IWD,N48470000,E044205680,,00480,0,,211,WGE,GUMRAK,S,Simulation application continuation,UN,E0097,00480,73577,2306,SEEUD URWWUR IWD   UR111050 IT N                   IWD N48470000E044205680     004800  211WGEGUMRAK                        ,SEEUD URWWUR IWD   UR2S    UN                                             E009700480                                       
S,EEU,D,,URWW,UR,,IWG,UR,11170,IT N,,,IWG,N48462980,E044192160,,00430,0,,277,WGE,GUMRAK,S,Simulation application continuation,UN,E0097,00430,73579,2306,SEEUD URWWUR IWG   UR111170 IT N                   IWG N48462980E044192160     004300  277WGEGUMRAK                        ,SEEUD URWWUR IWG   UR2S    UN                                             E009700430                                       
S,EEU,D,,USCC,US,,IKS,US,10870,ITDN,,,IKS,N55181540,E061312780,,00800,0,02,151,WGE,BALANDINO,S,Simulation application continuation,UN,E0142,00800,73581,2409,SEEUD USCCUS IKS   US110870 ITDN                   IKS N55181540E061312780     00800002151WGEBALANDINO                     ,SEEUD USCCUS IKS   US2S    UN                                             E014200800                                       
S,EEU,D,,USCC,US,,ILB,US,10990,ITDN,,,ILB,N55183560,E061290190,,00800,0,02,089,WGE,BALANDINO,S,Simulation application continuation,UN,E0142,00800,73583,2409,SEEUD USCCUS ILB   US110990 ITDN                   ILB N55183560E061290190     00800002089WGEBALANDINO                     ,SEEUD USCCUS ILB   US2S    UN                                             E014200800                                       
S,EEU,D,,USCM,US,,ICP,US,10990,ITDN,,,ICP,N53241520,E058454800,,01400,0,02,149,WGE,MAGNITOGORSK,S,Simulation application continuation,UN,E0130,01400,73585,2501,SEEUD USCMUS ICP   US110990 ITDN                   ICP N53241520E058454800     01400002149WGEMAGNITOGORSK                  ,SEEUD USCMUS ICP   US2S    UN                                             E013001400                                       
S,EEU,D,,USCM,US,,IRF,US,10870,ITDN,,,IRF,N53225610,E058445430,,01500,0,02,123,WGE,MAGNITOGORSK,S,Simulation application continuation,UN,E0130,01500,73587,2401,SEEUD USCMUS IRF   US110870 ITDN                   IRF N53225610E058445430     01500002123WGEMAGNITOGORSK                  ,SEEUD USCMUS IRF   US2S    UN                                             E013001500                                       
S,EEU,D,,USDA,US,,ITB,US,10890,ITDN,,,ITB,N71124280,E072004020,,00096,0,02,,WGE,SABETTA,S,Simulation application continuation,UN,E0301,00096,73589,2310,SEEUD USDAUS ITB   US110890 ITDN                   ITB N71124280E072004020     00096002   WGESABETTA                       ,SEEUD USDAUS ITB   US2S    UN                                             E030100096                                       
S,EEU,D,,USDD,US,,IDM,US,11130,ITDN,,,IDM,N66353970,E066380170,,00200,0,02,,WGE,SALEKHARD,S,Simulation application continuation,UN,E0245,00200,73591,2412,SEEUD USDDUS IDM   US111130 ITDN                   IDM N66353970E066380170     00200002   WGESALEKHARD                     ,SEEUD USDDUS IDM   US2S    UN                                             E024500200                                       
S,EEU,D,,USDD,US,,INA,US,11150,ITDN,,,INA,N66350610,E066352660,,00200,0,02,,WGE,SALEKHARD,S,Simulation application continuation,UN,E0245,00200,73593,2112,SEEUD USDDUS INA   US111150 ITDN                   INA N66350610E066352660     00200002   WGESALEKHARD                     ,SEEUD USDDUS INA   US2S    UN                                             E024500200                                       
S,EEU,D,,USHH,US,,IZJ,US,11010,IT N,,,IZJ,N61015600,E069061580,,00141,0,,325,WGE,KHANTY-MANSIYSK,S,Simulation application continuation,UN,E0180,00141,73595,2313,SEEUD USHHUS IZJ   US111010 IT N                   IZJ N61015600E069061580     001410  325WGEKHANTY-MANSIYSK               ,SEEUD USHHUS IZJ   US2S    UN                                             E018000141                                       
S,EEU,D,,USHN,US,,ILS,US,11030,ITDN,,,ILS,N62060460,E065365840,,00394,0,02,100,WGE,NYAGAN,S,Simulation application continuation,UN,E0197,00394,73597,2501,SEEUD USHNUS ILS   US111030 ITDN                   ILS N62060460E065365840     00394002100WGENYAGAN                        ,SEEUD USHNUS ILS   US2S    UN                                             E019700394                                       
S,EEU,D,,USHQ,US,,IIU,US,11030,ITDN,,,IIU,N63414200,E066421300,,00100,0,02,100,WGE,BELOYARSKIY,S,Simulation application continuation,UN,E0212,00100,73599,2413,SEEUD USHQUS IIU   US111030 ITDN                   IIU N63414200E066421300     00100002100WGEBELOYARSKIY                   ,SEEUD USHQUS IIU   US2S    UN                                             E021200100                                       
S,EEU,D,,USII,US,,ILV,US,10870,ITDN,,,ILV,N56503320,E053281870,,00500,0,02,160,WGE,IZHEVSK,S,Simulation application continuation,UN,E0152,00500,73601,2306,SEEUD USIIUS ILV   US110870 ITDN                   ILV N56503320E053281870     00500002160WGEIZHEVSK                       ,SEEUD USIIUS ILV   US2S    UN                                             E015200500                                       
S,EEU,D,,USII,US,,IMD,US,11030,ITDN,,,IMD,N56493550,E053272850,,00600,0,02,105,WGE,IZHEVSK,S,Simulation application continuation,UN,E0152,00600,73603,2401,SEEUD USIIUS IMD   US111030 ITDN                   IMD N56493550E053272850     00600002105WGEIZHEVSK                       ,SEEUD USIIUS IMD   US2S    UN                                             E015200600                                       
S,EEU,D,,USKK,US,,IOR,US,10930,ITDN,,,IOR,N58295200,E049195400,,00500,0,02,417,WGE,POBEDILOVO,S,Simulation application continuation,UN,E0160,00500,73605,2501,SEEUD USKKUS IOR   US110930 ITDN                   IOR N58295200E049195400     00500002417WGEPOBEDILOVO                    ,SEEUD USKKUS IOR   US2S    UN                                             E016000500                                       
S,EEU,D,,USKK,US,,IXA,US,10990,ITDN,,,IXA,N58303840,E049213180,,00500,0,20,198,WGE,POBEDILOVO,S,Simulation application continuation,UN,E0160,00500,73607,2501,SEEUD USKKUS IXA   US110990 ITDN                   IXA N58303840E049213180     00500020198WGEPOBEDILOVO                    ,SEEUD USKKUS IXA   US2S    UN                                             E016000500                                       
S,EEU,D,,USMM,US,,INO,US,11050,ITDN,,,INO,N65292690,E072413410,,00049,0,02,249,WGE,NADYM,S,Simulation application continuation,UN,E0219,00049,73609,2312,SEEUD USMMUS INO   US111050 ITDN                   INO N65292690E072413410     00049002249WGENADYM                         ,SEEUD USMMUS INO   US2S    UN                                             E021900049                                       
S,EEU,D,,USMM,US,,IPZ,US,11030,ITDN,,,IPZ,N65282900,E072423170,,00098,0,02,188,WGE,NADYM,S,Simulation application continuation,UN,E0218,00098,73611,2312,SEEUD USMMUS IPZ   US111030 ITDN                   IPZ N65282900E072423170     00098002188WGENADYM                         ,SEEUD USMMUS IPZ   US2S    UN                                             E021800098                                       
S,EEU,D,,USMQ,US,,IMB,US,11010,ITDN,,,IMB,N67594570,E075052870,,00100,0,02,445,WGE,YAMBURG,S,Simulation application continuation,UN,E0243,00100,73613,2305,SEEUD USMQUS IMB   US111010 ITDN                   IMB N67594570E075052870     00100002445WGEYAMBURG                       ,SEEUD USMQUS IMB   US2S    UN                                             E024300100                                       
S,EEU,D,,USMU,US,,IND,US,11095,ITDN,,,IND,N66041750,E076295470,,00200,0,02,,WGE,NOVY URENGOY,S,Simulation application continuation,UN,E0211,00200,73615,2213,SEEUD USMUUS IND   US111095 ITDN                   IND N66041750E076295470     00200002   WGENOVY URENGOY                  ,SEEUD USMUUS IND   US2S    UN                                             E021100200                                       
S,EEU,D,,USNN,US,,IJH,US,11050,ITDN,,,IJH,N60563200,E076275430,,00150,0,02,092,WGE,NIZHNEVARTOVSK,S,Simulation application continuation,UN,E0156,00150,73617,2204,SEEUD USNNUS IJH   US111050 ITDN                   IJH N60563200E076275430     00150002092WGENIZHNEVARTOVSK                ,SEEUD USNNUS IJH   US2S    UN                                             E015600150                                       
S,EEU,D,,USNN,US,,INZ,US,11190,ITDN,,,INZ,N60573330,E076294600,,00180,0,02,,WGE,NIZHNEVARTOVSK,S,Simulation application continuation,UN,E0156,00180,73619,2204,SEEUD USNNUS INZ   US111190 ITDN                   INZ N60573330E076294600     00180002   WGENIZHNEVARTOVSK                ,SEEUD USNNUS INZ   US2S    UN                                             E015600180                                       
S,EEU,D,,USPP,US,,IBK,US,11030,ITDN,,,IBK,N57542580,E056001520,,00400,0,02,105,WGE,BOLSHOE SAVINO,S,Simulation application continuation,UN,E0162,00400,73621,2504,SEEUD USPPUS IBK   US111030 ITDN                   IBK N57542580E056001520     00400002105WGEBOLSHOE SAVINO                ,SEEUD USPPUS IBK   US2S    UN                                             E016200400                                       
S,EEU,D,,USRK,US,,IKG,US,10850,ITDN,,,IKG,N62115490,E074322060,,00200,0,02,063,WGE,KOGALYM,S,Simulation application continuation,UN,E0176,00200,73623,2408,SEEUD USRKUS IKG   US110850 ITDN                   IKG N62115490E074322060     00200002063WGEKOGALYM                       ,SEEUD USRKUS IKG   US2S    UN                                             E017600200                                       
S,EEU,D,,USRO,US,,IUC,US,10850,ITDN,,,IUC,N63113210,E075162660,,00440,0,02,063,WGE,NOYABRSK,S,Simulation application continuation,UN,E0183,00440,73625,2502,SEEUD USROUS IUC   US110850 ITDN                   IUC N63113210E075162660     00440002063WGENOYABRSK                      ,SEEUD USROUS IUC   US2S    UN                                             E018300440                                       
S,EEU,D,,USRO,US,,IZE,US,10910,ITDN,,,IZE,N63103670,E075152980,,00440,0,02,121,WGE,NOYABRSK,S,Simulation application continuation,UN,E0183,00440,73627,2502,SEEUD USROUS IZE   US110910 ITDN                   IZE N63103670E075152980     00440002121WGENOYABRSK                      ,SEEUD USROUS IZE   US2S    UN                                             E018300440                                       
S,EEU,D,,USRR,US,,IAM,US,10910,ITDN,,,IAM,N61204380,E073252240,,00200,0,02,121,WGE,SURGUT,S,Simulation application continuation,UN,E0171,00200,73629,2307,SEEUD USRRUS IAM   US110910 ITDN                   IAM N61204380E073252240     00200002121WGESURGUT                        ,SEEUD USRRUS IAM   US2S    UN                                             E017100200                                       
S,EEU,D,,USRR,US,,IGK,US,11050,ITDN,,,IGK,N61204350,E073225440,,00200,0,02,092,WGE,SURGUT,S,Simulation application continuation,UN,E0172,00200,73631,2307,SEEUD USRRUS IGK   US111050 ITDN                   IGK N61204350E073225440     00200002092WGESURGUT                        ,SEEUD USRRUS IGK   US2S    UN                                             E017200200                                       
S,EEU,D,,USSS,US,,IED,US,10950,ITDN,,,IED,N56442250,E060490530,,00800,0,02,300,WGE,KOLTSOVO,S,Simulation application continuation,UN,E0153,00800,73633,2110,SEEUD USSSUS IED   US110950 ITDN                   IED N56442250E060490530     00800002300WGEKOLTSOVO                      ,SEEUD USSSUS IED   US2S    UN                                             E015300800                                       
S,EEU,D,,USSS,US,,IEL,US,10990,ITDN,,,IEL,N56442740,E060470370,,00800,0,02,089,WGE,KOLTSOVO,S,Simulation application continuation,UN,E0153,00800,73635,2110,SEEUD USSSUS IEL   US110990 ITDN                   IEL N56442740E060470370     00800002089WGEKOLTSOVO                      ,SEEUD USSSUS IEL   US2S    UN                                             E015300800                                       
S,EEU,D,,USSS,US,,IEU,US,11050,ITDN,,,IEU,N56443590,E060490390,,00766,0,02,392,WGE,KOLTSOVO,S,Simulation application continuation,UN,E0153,00766,73637,2013,SEEUD USSSUS IEU   US111050 ITDN                   IEU N56443590E060490390     00766002392WGEKOLTSOVO                      ,SEEUD USSSUS IEU   US2S    UN                                             E015300766                                       
S,EEU,D,,USSS,US,,IKO,US,11170,ITDN,,,IKO,N56443620,E060465960,,00766,0,02,232,WGE,KOLTSOVO,S,Simulation application continuation,UN,E0154,00766,73639,2013,SEEUD USSSUS IKO   US111170 ITDN                   IKO N56443620E060465960     00766002232WGEKOLTSOVO                      ,SEEUD USSSUS IKO   US2S    UN                                             E015400766                                       
S,EEU,D,,USTJ,US,,ISE,US,11030,ITDN,,,ISE,N58032630,E068214910,,00200,0,02,256,WGE,REMEZOV,S,Simulation application continuation,UN,E0156,00200,73641,2112,SEEUD USTJUS ISE   US111030 ITDN                   ISE N58032630E068214910     00200002256WGEREMEZOV                       ,SEEUD USTJUS ISE   US2S    UN                                             E015600200                                       
S,EEU,D,,USTR,US,,IAT,US,11110,ITDN,,,IAT,N57102430,E065205900,,00400,0,02,561,WGE,ROSHCHINO,S,Simulation application continuation,UN,E0153,00400,73643,2306,SEEUD USTRUS IAT   US111110 ITDN                   IAT N57102430E065205900     00400002561WGEROSHCHINO                     ,SEEUD USTRUS IAT   US2S    UN                                             E015300400                                       
S,EEU,D,,USTR,US,,IRN,US,10830,ITDN,,,IRN,N57101980,E065165950,,00400,0,02,195,WGE,ROSHCHINO,S,Simulation application continuation,UN,E0153,00400,73645,2313,SEEUD USTRUS IRN   US110830 ITDN                   IRN N57101980E065165950     00400002195WGEROSHCHINO                     ,SEEUD USTRUS IRN   US2S    UN                                             E015300400                                       
S,EEU,D,,USTR,US,,ITM,US,11070,ITDN,,,ITM,N57111230,E065184570,,00400,0,02,247,WGE,ROSHCHINO,S,Simulation application continuation,UN,E0153,00400,73647,2313,SEEUD USTRUS ITM   US111070 ITDN                   ITM N57111230E065184570     00400002247WGEROSHCHINO                     ,SEEUD USTRUS ITM   US2S    UN                                             E015300400                                       
S,EEU,D,,USUU,US,,IRD,US,11090,ITDN,,,IRD,N55280560,E065241750,,00300,0,02,336,WGE,KURGAN,S,Simulation application continuation,UN,E0140,00300,73649,2403,SEEUD USUUUS IRD   US111090 ITDN                   IRD N55280560E065241750     00300002336WGEKURGAN                        ,SEEUD USUUUS IRD   US2S    UN                                             E014000300                                       
S,EEU,D,,USUU,US,,IUN,US,10990,ITDN,,,IUN,N55285900,E065251410,,00200,0,02,135,WGE,KURGAN,S,Simulation application continuation,UN,E0140,00200,73651,2504,SEEUD USUUUS IUN   US110990 ITDN                   IUN N55285900E065251410     00200002135WGEKURGAN                        ,SEEUD USUUUS IUN   US2S    UN                                             E014000200                                       
S,EEU,D,,UTAA,UT,,ABW,UT,10850,IT N,,,ABW,N37595950,E058204920,,00700,0,,542,WGE,ASHGABAT,S,Simulation application continuation,UN,E0053,00700,73653,2205,SEEUD UTAAUT ABW   UT110850 IT N                   ABW N37595950E058204920     007000  542WGEASHGABAT                      ,SEEUD UTAAUT ABW   UT2S    UN                                             E005300700                                       
S,EEU,D,,UTAA,UT,,AHD,UT,10870,IT N,,,AHD,N37590850,E058224240,,00700,0,,342,WGE,ASHGABAT,S,Simulation application continuation,UN,E0053,00700,73655,2205,SEEUD UTAAUT AHD   UT110870 IT N                   AHD N37590850E058224240     007000  342WGEASHGABAT                      ,SEEUD UTAAUT AHD   UT2S    UN                                             E005300700                                       
S,EEU,D,,UTAA,UT,,IAD,UT,11110,IT N,,,IAD,N37591520,E058201790,,00700,0,,336,WGE,ASHGABAT,S,Simulation application continuation,UN,E0053,00700,73657,2205,SEEUD UTAAUT IAD   UT111110 IT N                   IAD N37591520E058201790     007000  336WGEASHGABAT                      ,SEEUD UTAAUT IAD   UT2S    UN                                             E005300700                                       
S,EEU,D,,UTAA,UT,,IPQ,UT,11050,IT N,,,IPQ,N37582500,E058221070,,00700,0,,251,WGE,ASHGABAT,S,Simulation application continuation,UN,E0053,00700,73659,2205,SEEUD UTAAUT IPQ   UT111050 IT N                   IPQ N37582500E058221070     007000  251WGEASHGABAT                      ,SEEUD UTAAUT IPQ   UT2S    UN                                             E005300700                                       
S,EEU,D,,UTAK,UT,,ITL,UT,10910,IT N,,,ITL,N40031100,E053002300,,00285,0,,301,WGE,TURKMENBASHI,S,Simulation application continuation,UN,E0063,00285,73661,2213,SEEUD UTAKUT ITL   UT110910 IT N                   ITL N40031100E053002300     002850  301WGETURKMENBASHI                  ,SEEUD UTAKUT ITL   UT2S    UN                                             E006300285                                       
S,EEU,D,,UTAK,UT,,ITR,UT,11170,IT N,,,ITR,N40043900,E052595700,,00285,0,,137,WGE,TURKMENBASHI,S,Simulation application continuation,UN,E0063,00285,73663,2213,SEEUD UTAKUT ITR   UT111170 IT N                   ITR N40043900E052595700     002850  137WGETURKMENBASHI                  ,SEEUD UTAKUT ITR   UT2S    UN                                             E006300285                                       
S,EEU,D,,UTAM,UT,,IML,UT,11150,IT N,,,IML,N37363800,E061534200,,00732,0,,395,WGE,MARY,S,Simulation application continuation,UN,E0050,00732,73665,2205,SEEUD UTAMUT IML   UT111150 IT N                   IML N37363800E061534200     007320  395WGEMARY                          ,SEEUD UTAMUT IML   UT2S    UN                                             E005000732                                       
S,EEU,D,,UTAT,UT,,IRP,UT,10830,IT N,,,IRP,N41453090,E059485540,,00282,0,,469,WGE,DASHOGUZ,S,Simulation application continuation,UN,E0067,00282,73667,2213,SEEUD UTATUT IRP   UT110830 IT N                   IRP N41453090E059485540     002820  469WGEDASHOGUZ                      ,SEEUD UTATUT IRP   UT2S    UN                                             E006700282                                       
S,EEU,D,,UTAT,UT,,ISH,UT,11130,IT N,,,ISH,N41453059,E059511211,,00282,0,,396,WGE,DASHOGUZ,S,Simulation application continuation,UN,E0067,00282,73669,2213,SEEUD UTATUT ISH   UT111130 IT N                   ISH N41453059E059511211     002820  396WGEDASHOGUZ                      ,SEEUD UTATUT ISH   UT2S    UN                                             E006700282                                       
S,EEU,D,,UTAV,UT,,IHQ,UT,11030,IT N,,,IHQ,N38561986,E063325645,,00649,0,,204,WGE,TURKMENABAT,S,Simulation application continuation,UN,E0053,00649,73671,2205,SEEUD UTAVUT IHQ   UT111030 IT N                   IHQ N38561986E063325645     006490  204WGETURKMENABAT                   ,SEEUD UTAVUT IHQ   UT2S    UN                                             E005300649                                       
S,EEU,D,,UTAV,UT,,IUT,UT,11050,IT N,,,IUT,N38551400,E063343540,,00649,0,,251,WGE,TURKMENABAT,S,Simulation application continuation,UN,E0053,00649,73673,2205,SEEUD UTAVUT IUT   UT111050 IT N                   IUT N38551400E063343540     006490  251WGETURKMENABAT                   ,SEEUD UTAVUT IUT   UT2S    UN                                             E005300649                                       
S,EEU,D,,UTDD,UT,,IWG,UT,11030,IT N,,,IWG,N38324080,E068500520,,02569,0,,104,WGE,DUSHANBE,S,Simulation application continuation,UN,E0047,02569,73675,2503,SEEUD UTDDUT IWG   UT111030 IT N                   IWG N38324080E068500520     025690  104WGEDUSHANBE                      ,SEEUD UTDDUT IWG   UT2S    UN                                             E004702569                                       
S,EEU,D,,UTDK,UT,,ICG,UT,10810,IT N,,,ICG,N37583560,E069481020,,02221,0,,304,WGE,KULOB,S,Simulation application continuation,UN,E0044,02221,73677,2506,SEEUD UTDKUT ICG   UT110810 IT N                   ICG N37583560E069481020     022210  304WGEKULOB                         ,SEEUD UTDKUT ICG   UT2S    UN                                             E004402221                                       
S,EEU,D,,UTDL,UT,,IHD,UT,11150,IT N,,,IHD,N40125410,E069405180,,01450,0,,067,WGE,KHUJAND,S,Simulation application continuation,UN,E0052,01450,73679,2503,SEEUD UTDLUT IHD   UT111150 IT N                   IHD N40125410E069405180     014500  067WGEKHUJAND                       ,SEEUD UTDLUT IHD   UT2S    UN                                             E005201450                                       
